4TR6J693M9XK,0c436f7f-d404-434b-86d9-599a28adb9e0,bef3430b-0bfc-4ee7-8a59-3991e0d55746,false,,3044131191,A strange number called me from our local area and I wanted to see if it was from anything that I recognized.,6/21/22 14:35:00
ADCXHGCQRA34,c1c8f88e-763e-43ee-ac6f-5a3579609678,bf326c89-ca15-43f3-9985-2ae5a77a303d,false,,Kijuan Byrd,I am looking for a possible Wikipedia page that has to do with the shooting of Kijuan Bird.,6/23/22 21:24:00
6CNHTCG6W6XM,ceeab770-7e09-4638-ac35-3e49db65c02a,bfc57b1d-7632-4375-9bc0-5fb896f34133,false,,davao to germany flights,I am planning to visit my friend in Germany by early next year so I was looking for flights from my current city to Germany. I just wanted an estimate of the cost and the available flight schedule so that I can plan ahead and budget ahead.,6/12/22 08:02:00
AZZDZJGYZWJ3,ea1c5277-f7cb-413b-b541-ff3c7a6927f4,c01800e8-29ed-4c10-8b98-e55bd6d66e18,false,,twitter,"I wanted to access Twitter, so I did so via a Google search as I knew the first link would be Twitter.",6/28/22 12:33:00
EGZANDYA4C6Q,379db49c-f811-4905-8bb6-92cf5b3e2af5,c17fb4cf-5e77-445f-9717-b96f206bfae2,false,,gospel of thomas james,I was looking for a passage from the Gospel of Thomas that referred to James. I was hoping passage would be the top result and I could just read it and move on.,6/27/22 16:21:00
4TNHZX6VKQAA,21645076-2ea3-451d-8b5e-ed2156e9a769,c23826dd-bf38-49ac-8337-c541de3a4315,false,,kaiser address roseville,"I was looking for the address of Kaiser Permanente in Roseville, CA.",6/17/22 17:09:00
6CNHTCG6W6XM,6ac72437-3482-43b5-9cc1-22e86717e84f,c246fc65-eb6b-489b-ab1f-a4645a376111,false,,fit to work class b,I was looking for the full description of Class B in issuing medical certificates for work.,6/24/22 13:18:00
Y72KN4H9FMJJ,3c7fbe21-d4ff-431d-b0b2-2e6cdcbb4ee2,c2b27c0a-0114-4f2a-b4d4-4cd12b08d845,false,,broken right clavicle,"I'm trying to find information about a particular injury to the shoulder. I'm hoping to find a range of information, such as severity, treatment options, and typical recovery time.",6/11/22 08:47:00
MVMZFQEH2MYN,ef2e092a-0db0-4fb4-aa08-e891e4860616,c2b769c4-03c5-49d3-ab39-c779754a90fe,false,,index match to find min value,"I wanted a specific formula that returns the value of a cell when compared with the same row in a different range (something like this =INDEX(F3:F11,MATCH(MIN(C3:C11),C3:C11,0))",6/14/22 22:27:00
X6P6DQRXD62A,3b152d06-5aa0-486c-925b-23178d35f362,c2bb78cb-009b-4673-8c16-fbe25cedba04,false,,The Quarry game,I wanted to find more information on the new video game The Quarry. I was hoping Google would list several news stories about it,6/09/22 21:42:00
X6P6DQRXD62A,10bfe730-3162-4a95-a853-48a058ff390a,c3909864-ec72-4f58-9260-0941bec99f73,false,,vita flashing battery,My Playstation Vita (a handheld game console) was displaying a flashing battery picture when I pressed the power button. I was trying to find out what this meant.,6/14/22 10:57:00
AZZDZJGYZWJ3,72d2c174-a7e9-4566-b99e-c5fb65d8480e,c3a6f7d7-830a-4777-b3e4-cde7bb381b41,false,,What is in the category connector of USB-C?,"This was for a gig work search, so I was trying to find out information that could help me answer this question and compare it to given answers.",6/25/22 12:33:00
6CNHTCG6W6XM,bee8b7e8-4734-4bc1-9292-916f6cf33c9c,c3aa16be-a805-414b-a02a-3e56e5294740,false,,owndays complaints,I was looking for a way to file a complaint for a particular store to which I had a bad customer experience.,6/18/22 16:19:00
AZZDZJGYZWJ3,de0713fd-30cc-4826-90ee-42ae447cc925,c42c21dc-61ad-4c20-b403-522b8002cb15,false,,UNDP country code of São Tomé and Príncipe,"I was trying to find the specific UNDP country code for São Tomé and Príncipe and was able to find it. I found it pretty easily, if I remember.",6/25/22 12:40:00
QD6PJTFGJ63Q,cdd78e1b-e0d3-4b6f-8c2a-0bb46e97daaf,c5351c68-9108-41c2-ba0d-b32fc44e8f52,false,,zero carb tortillas reddit,"I'm trying to do a keto diet. I found these zero-carb tortillas, and I've hit a snag in weight loss, I wanted to see if other people were experiencing the same thing.",6/25/22 11:15:00
4TR6J693M9XK,5ad58322-f935-4198-9dcf-05544eb3c35c,c5476ce2-cde6-4d59-8a38-03b01ba2f1be,false,,can you deposit cash at an atm,I need to deposit money into my account and wanted to see if I could do it at my local bank's atm because they are closed.,6/21/22 17:15:00
QD6PJTFGJ63Q,62e0c589-b8dd-430e-8b83-3a22335740d2,c6ce8448-cb3b-456d-a738-3ade7ba5d6b3,false,,hemispheres arpeggiator,This is an alternative firmware for another synth module I have. I wanted to see if it had that particular application.,6/24/22 20:29:00
Y72KN4H9FMJJ,c2707b4e-6fea-437d-abb8-d6a433107440,c6f0243d-e8ed-4338-b441-acc2825ed190,false,,how to make paper tape stick on gauze,I'm trying to figure out the most effective way to make paper tape stick to a wound wrapped in gauze.,6/11/22 08:12:00
6CNHTCG6W6XM,5fef722d-40ed-4408-9084-a9cb46e474f5,c7f09ae9-a734-441d-91de-76599771a572,false,,ucsd masters in clinical research,I wanted to find out about the application period as well as the requirements of a masters program in UCSD. A link to the official website would be ideal.,6/23/22 20:44:00
X6P6DQRXD62A,38ceadfb-c018-4991-9e2f-598536457086,c8120b3c-88d0-40c3-8f1d-b0f9011ce776,false,,bitcoin price,I wanted to know the price of the cryptocurrency Bitcoin as it has been in free fall. I knew searching for this would lead to several pages with the answer,6/16/22 22:01:00
MVMZFQEH2MYN,8369a5c1-2c5e-45a6-8a80-8e575d797163,c8defdb3-51be-4908-be2f-8122b0951abb,false,,what to do in tarapoto peru,I am planning a small trip to this town and wanted to check some fun activities and tourist places,6/18/22 13:04:00
4TNHZX6VKQAA,16101cc7-617b-4b64-a8ee-3216e5aa3d06,c99767cc-969c-4a1f-bf7c-544592d1c2ef,false,,delhi 1940,"I wanted to see was Delhi, India looked like in the 1940s.",6/21/22 23:05:00
MVMZFQEH2MYN,6bf301d7-e898-4934-a910-6eed8c7c9458,c9e6af79-a6dd-47d0-95c6-752f44a90491,false,,manga reader online android,I wanted to check some alternatives and apps for Android since I am writing something about it,6/22/22 10:13:00
6CNHTCG6W6XM,041edaf8-1c59-4e53-92ee-a11a91e152e9,cadf8132-d2c8-42b8-b6fd-b15619cfa81f,false,,periodontal abscess,I wanted more information about periodontal abscess specially its signs and symptoms and treatment.,6/23/22 09:22:00
X6P6DQRXD62A,99cecd57-743b-41f4-a8fc-bbfbca5924a5,cb841613-f424-47e2-8b12-e32af22d735d,false,,Tales of Hearts R English voices,Tales of Hearts R is a role playing game for the Playstation Vita. I was trying to find out if the voice acting was in Japanese or English.,6/14/22 22:43:00
AZZDZJGYZWJ3,a04c45f2-8259-4e64-92cb-4ee8896cdfe1,cb94023b-70a2-4c04-a7a2-8b48b57410b3,false,,twitter,I was trying to get to the Twitter site via a google search.,6/25/22 06:51:00
6CNHTCG6W6XM,b93e587c-2642-4692-b5ea-c0e3675c0f7b,cbe17eb7-253f-4141-a2c8-b59eebd73369,false,,asics sandals,I was looking for a particular footwear that I am planning to gift to my father for the upcoming father's day celebration. I was wondering if I could buy it online since I cannot really find the item in actual stores.,6/10/22 19:24:00
X6P6DQRXD62A,25e3626f-7735-4538-9c63-1d0060ffa318,cd0c3939-c02c-4056-8e7c-5b86427d8a20,false,,win 10 quick format vs format,I needed to format a USB memory stick. I wanted to know if there was a difference between using quick format or going the formatting option that takes longer.,6/14/22 22:55:00
MVMZFQEH2MYN,5da8799a-73d9-44f0-9dfe-38c092fa2374,cdacba11-df74-4311-9e7e-c5cb09c74e66,false,,cdt actual time,I wanted to check the exact time in this timezone and check if it was the same one as mine,6/22/22 19:35:00
4TNHZX6VKQAA,01bfe57b-8ab5-4356-8ff7-ecdf967faca4,cdafc3ee-9199-4b57-8e6e-cb85fc0c65ef,false,,ronca meaning,"I wanted to clarify the meaning of ""ronca"" in Spanish.",6/20/22 14:23:00
QD6PJTFGJ63Q,f1b22116-4f5f-4828-be82-8206bde9a42e,ce23e523-3388-4ae7-8859-a300f4b69f2a,false,,vo2 max not improving,I've been running for the past month and my vo2 measurement hadn't been improving. I was hoping to see if I was doing something wrong.,6/23/22 19:38:00
EGZANDYA4C6Q,85ffa30a-3d3a-4ea7-9876-ea4c0da32b45,ce3c8d65-4fd0-4f4e-aad3-972a64073b73,false,,i have an irl problem with someone in the acclaimed reddit,I was trying to find a specific Reddit thread to confirm a rumor I found on a wrestling message board. I was hoping to find the actual Reddit thread.,6/28/22 18:48:00
4TNHZX6VKQAA,f4dd84a4-4d5f-4aa7-9866-78c63d695212,ce66f1c4-5ceb-4fec-ac19-1238c7b73daa,false,,bayou,"I wanted to know what the meaning of the word ""bayou"" is.",6/11/22 01:01:00
AZZDZJGYZWJ3,2e89be6f-d434-4c57-aa6a-231ee77021a7,cfe01622-07b2-48ac-bf08-4497aa917e69,false,,C0017380,"I believe this was the UMLS CUI for standard genetic code, but I just copy and pasted this answer to see what it might turn up and if it could confirm anything.",6/29/22 01:21:00
6CNHTCG6W6XM,893a3faf-0605-4e0f-8a61-6971b57138bc,d107e42e-394a-4e31-b544-85ea9ae7ce45,false,,wipeout for birkenstock,I was wondering if Wipeout can be used on Birkenstocks for cleaning. I was looking for forums or guides or videos wherein Wipeout was used for cleaning Birkenstocks.,6/23/22 16:03:00
ADCXHGCQRA34,8578fdbf-a827-4bc3-9484-6be943836298,d1530fef-301f-4edc-834f-44bb95b225e8,false,,How did Serbia form,I want to know how and when Serbia was created. I am looking for a snippet explaining this.,6/20/22 05:35:00
QD6PJTFGJ63Q,9eaccf00-28fb-4e38-a77e-1951974b1f5a,d18fee91-5df9-4798-93fc-9ae6921307db,false,,opa4991,I was looking at an electronic component for a circuit board. I wanted to check for price and availability.,6/26/22 07:48:00
X6P6DQRXD62A,c778c206-688d-42a8-a177-883755c194e4,d1d734a1-c1c5-4c74-9e7e-e2a3a3be37c7,false,,LOLTNA History,"TNA was a pro wrestling league with a reputation for being really bad and doing dumb things on their shows. I was looking for a link to a well known, fan-made wiki called LOLTNA history that cataloged the aforementioned dumb things.",6/09/22 23:34:00
NFN2M74RPJ2Q,55212410-fdf3-4bf1-8e4e-8de7e01d6ae2,d2322570-cd9e-4545-b71e-a2becb5c036e,false,,Cisco UCS blade chassis specs,I'm trying to get information regarding a piece of data center technology and see how it compares with a product that I'm more familiar with for work. The official support site with product guides would be particularly useful.,6/14/22 17:32:00
MVMZFQEH2MYN,978f9412-ff13-4972-bb67-c243b7daa8c8,d34d2fd7-ef90-4735-adcc-32808207815f,false,,iphone 10r price,I wanted to check how much is this smartphone on my local currency to compare it with other options,6/15/22 18:37:00
4TNHZX6VKQAA,f8678592-6845-4ddf-bbe4-25ca74c14875,d3625931-5034-4a1f-8de4-9dcf087a56ff,false,,virus bacteria diagram,I was looking for a graphic that showed the difference between a virus and a bacteria.,6/17/22 08:16:00
QD6PJTFGJ63Q,ce005125-7649-4d48-b44d-f2069bc11dc9,d3ed5632-57e6-4ce8-bb58-6bc5f1078118,false,,8051 microcontroller,I was looking for more information on an electronic microcontroller.,6/23/22 18:31:00
X6P6DQRXD62A,f640c931-9e13-4221-96b4-d792626cb122,d40bf96f-7d9a-439a-a4c5-328fe1a79b57,false,,uncharted 2 digital treasure map,I wanted to know what this DLC for the game Uncharted 2 did exactly. Was hoping a gaming site would the info I needed,6/18/22 16:25:00
AZZDZJGYZWJ3,a9c9f925-7473-4b8b-9a79-13f7bb1d2469,d4d71797-63ed-4589-817d-0d39e8f25659,false,,UNESCO language status for Finnish?,"I had a given answer to this query, and I was hoping to see if I can confirm it on a site.",6/29/22 01:23:00
4TNHZX6VKQAA,7679cb3d-15b8-4fa7-a806-86948243c1a4,d4ef5a1c-7b9b-40e6-8498-d818bc1cb01f,false,,india british colony,I wanted to know for how long India was a British colony and what it looked like during that time.,6/21/22 23:05:00
4TNHZX6VKQAA,b8f50588-bfca-4c7c-8362-832b0431d8e2,d517591b-6cd1-420f-ab03-d414278a01d5,false,,vertebrae,I wanted to see an image or description of vertebrae to figure out whether or not it was related to the spine.,6/15/22 13:53:00
X6P6DQRXD62A,c21b81d3-bf08-475f-a196-eeffdcb1d9c7,d5a76f78-26ec-406c-9cc4-4360f8d7b600,false,,Mickey Rourke plastic surgery,I was looking for pictures of the actor Mickey Rourke who is known for having had a lot of plastic surgery.,6/12/22 15:44:00
MVMZFQEH2MYN,cd046011-1d98-4f0e-b8e4-d4be31a723da,d5eb7665-6047-4200-ad04-e278a9b49294,false,,sneak past,I wanted to double check the correct past tense of this verb.,6/11/22 21:55:00
MVMZFQEH2MYN,9debca6c-a407-477d-99d2-9f0241413220,d5f9586a-828e-4379-82e6-319fd72592c4,false,,Jurassic World Dominion,I wanted to check if this movie was available in theaters near my location,6/13/22 23:41:00
X6P6DQRXD62A,a2a69c8d-4cbc-4f7b-b66d-5ba350da444d,d6e7ca2c-3d65-47b9-8e75-f5fbbf45185b,false,,hard swollen chin,My chin began to swell up and get really hard. I was hoping to find info on why this keeps happening,6/17/22 11:15:00
MVMZFQEH2MYN,4b1baeee-7420-46a1-a37a-814a3969f49e,d7988791-8b9c-4de5-a1fc-af280ef919f1,false,,jurassic world dominion cast,I wanted to check the names of the actors on this movie,6/14/22 23:14:00
MVMZFQEH2MYN,d1df161b-a9bb-491d-8953-7a19ab0e5b9e,d7d8a11e-9ab9-4b49-803e-4e31add64b49,false,,wotlk release date,I wanted to check both dates of the original launch and the relaunch of a game,6/23/22 13:55:00
QD6PJTFGJ63Q,e0e97077-e813-40e0-8d08-6e052ec95712,d7ddc3fb-dca6-43c1-9826-1ac25fcea7e7,false,,gimp how to remove everything of a certain color,"I was making photo edits, and wasn't sure how to remove certain things.",6/25/22 14:18:00
ADCXHGCQRA34,55165ce9-c07b-463f-8f4d-7566212f3483,d846faa9-4009-4960-9e17-0436c9452b8a,false,,how does project zomboid remote play work,I want to know how to use remote play on project zomboid. I want the first result to tell me how.,6/22/22 04:24:00
6CNHTCG6W6XM,5dbf1b89-1ab7-4496-8d80-c1e07d9820ef,d8979c52-b522-45ab-a23d-f3749f3d6ef5,false,,southampton to london,I wanted to know the distance from Southampton to London. I especially wanted to know the possible means of transportation and the travel time as well as the ease of travel.,6/22/22 15:45:00
7R2NKCJQNXPP,dda1df46-b571-4c0d-9755-699ca98b1e4b,d9513fbb-7136-48f0-a3df-5d231afa1920,false,,Cool ranch chicken tacos,I was looking for a recipe to make cool ranch chicken tacos.,6/28/22 08:18:00
4TR6J693M9XK,02285479-72e0-4f8f-be50-6c2915a00fa4,db08d611-ac1f-40ae-919e-e6c194f6f8fb,false,,Valvoline express care,I looked up the hours for a local oil change business because my car needed an oil change,6/22/22 07:43:00
QD6PJTFGJ63Q,fc447db7-c78a-4097-839d-d8a4104c5a2f,dc0d59e9-4d69-4ce1-800d-1336e2c548f4,false,,sparkling ice lemonade nutrition facts,"My previous search for this didn't yield the nutritional facts, I was hoping a more specific search would help.",6/24/22 11:06:00
QD6PJTFGJ63Q,95aab53d-b79e-40ee-bc5d-177e9d1790af,dc7a4635-32bf-41a2-a5c5-1f6f4a17d2b6,true,,battery for digital caliper,I have a digital caliper that needs a new battery. I was hoping to find the battery without having to open up the caliper.,6/23/22 13:18:00
QD6PJTFGJ63Q,115e3bb9-bc88-4b14-814b-c2c3ee3ad9d5,de17e811-6a9c-4e0a-a7a7-2438b0594283,false,,30 day notice to end lease utah,My mother asked for help in ending a lease for her tenant. I was hoping for a template I could fill out.,6/26/22 08:04:00
MVMZFQEH2MYN,859981f5-50e7-492d-b721-098444d1d0d2,de8240c1-e60d-4baf-9bbc-d8f322c7cb00,false,,recipes with chicken breasts and chili,I got some chili and wanted to prepare this recipe at home,6/20/22 22:05:00
4TNHZX6VKQAA,9cad008d-7b45-4e80-8932-0ebfb0336581,def08cc7-1f8f-4027-aae3-a1f3a791c0a9,false,,warm water vs cold water hand washing,I was looking for a video to explain to students the difference between washing your hands with warm and cold water.,6/17/22 08:34:00
4TNHZX6VKQAA,1dc3d1b3-b443-436d-8812-1b9ab22ce406,def32d86-858c-41cf-bf7b-f3ed5aa66e08,false,,immune system,I wanted a comprehensive diagram or description of the immune system.,6/16/22 11:32:00
MVMZFQEH2MYN,54bd41c5-55bc-4572-acd8-82bdd6db6e5b,df27b362-3fb2-4ff5-b20c-570e6a0b70ca,false,,who won colombian elections,I wanted a quick review of these elections and their results,6/19/22 18:07:00
AZZDZJGYZWJ3,10e262ec-25cc-45a8-9c23-56c879b91f6e,df636c8a-48fc-41df-99a6-e2841621e207,false,,World Rugby Hall of Fame ID for Colin Meads,I was looking for a World Rugby Hall of Fame ID for Colin Meads. I was hoping it'd be a link to a webpage or something I could find just on the Google search page itself.,6/25/22 12:46:00
4TNHZX6VKQAA,3f118332-4fb5-43ed-83fb-643d638061b1,e0d2c9ec-95cc-44ab-b9a9-c5debba939b9,false,,immune system functions,I wanted a comprehensive list of what the immune system does.,6/16/22 11:33:00
6CNHTCG6W6XM,3ca4c836-1e27-4a9c-8854-e66b0fae98ce,e17b407d-0b99-4bc6-a87a-1e71e793f6c5,false,,1 foot in inches,I wanted to find out how many inches is 1 foot. I wanted to have the answer right away in a snippet rather than having to open up a link after searching.,6/24/22 11:52:00
EGZANDYA4C6Q,3cb419ce-5cc0-4d23-af88-3af0b3ea8d38,e18dfddd-d75d-4f71-8919-063c8d59b0b1,false,,chrestos vs christos,"I was reading about Biblical history and saw the term ""chrestos"" referring to Jesus. I wanted to know more information from scholars on whether or not the term was more often used than ""christos"" during early Christianity.",6/27/22 16:34:00
X6P6DQRXD62A,71838386-3ba8-4f5f-b839-174d34709b77,e1d220a4-e5db-43cf-a022-fe5cf41147b8,false,,metal gear solid hd collection vs legacy,"Metal Gear Solid is a video game franchise that has released remasters of their older games remastered in HD twice. I wanted to find out which release, the HD Collection or the Legacy Collection was better so I knew which to download",6/12/22 15:26:00
6CNHTCG6W6XM,de4dbb50-87f9-4890-a122-a324dcd08023,e2449269-dd8e-483a-a2aa-36fdda151b22,false,,avamys nasal spray breastfeeding,I am looking to prescribe a particular medication to a patient but I wanted to find out more information regarding its effects on breastfeeding. I wanted to access results from medical journals from reliable sources.,6/14/22 14:41:00
QD6PJTFGJ63Q,df9ad9b5-e898-4924-b16e-aab58c9babbf,e2c05589-4ffe-49dd-a885-b59510faafd9,false,,Skr mini e3 v1.2,"I found this board recommended as a replacement, so I wanted more information.",6/27/22 19:21:00
MVMZFQEH2MYN,ada31464-a02d-4d18-9e5e-40116b8c3556,e2dd5c65-8fe0-4f2a-9a3d-97868c86eb1a,true,,sumif 2 conditions formula,I wanted to check the exact Excel formula for adding 2 different conditions in the same table.,6/18/22 19:01:00
4TR6J693M9XK,6414b752-8d7b-4f96-9841-9a55fd1753bf,e3032efa-f763-483c-843d-7b2673c8bea8,false,,How much is federal tax per gallon of gas,I wanted to know how much tax is on gas since it is supposed to be going away for 3 months.,6/22/22 08:47:00
NFN2M74RPJ2Q,bd472fd4-cb12-4466-8ce1-229262f4fe69,e4c171f5-aab7-4c5d-9b99-c280cbc487a4,false,,Does Nutanix still license SSD capacity?,"I'm looking at Nutanix hyperconverged software and need to find out how their licensing works - specifically whether or not they still charge for certain storage. I'd like a clear, official document as I have heard unofficial sources give conflicting information.",6/15/22 10:09:00
AZZDZJGYZWJ3,98b9fa38-bc14-4149-a2cd-0557b124cde5,e534bf9f-ce69-45b1-ab5b-56c3e550083c,false,,Unifrance person ID for Patrick Dewaere?,I had a given Unifrance person ID but I wanted to confirm it through a Google search.,6/29/22 01:27:00
X6P6DQRXD62A,0b90b3f9-722f-48d8-b047-6ba10cc07f45,e5f00a3a-33aa-4db5-93cc-756806f0e909,false,,Jiri Prochazka,Jiri Prochazkal is a fighter for the UFC who was challenging for the world championship on their most recent card. I wanted to find out more information about him and view his fighting history.,6/12/22 02:26:00
AZZDZJGYZWJ3,168336e5-90b1-46dd-8e27-72fb5215e4c8,e6a9fae8-bc8a-4923-a45a-432f35d13c54,false,,Wikimedia category for films shot in Lyon?,"I was looking up to see if there was a Wikimedia category specifically devoted to films shot in Lyon, and see if the result matched the given answer I had. I was hoping it would be just an easy match.",6/25/22 12:43:00
QD6PJTFGJ63Q,ef2917ee-6887-4771-8a48-536890828642,e751b616-e19a-4325-8673-57c73a31d384,false,,stolperbeats,I saw a synth module being discussed in a forum. I was hoping to find more information about the yet to be released product.,6/24/22 00:37:00
MVMZFQEH2MYN,9eb59cc0-a416-4c09-aff6-f748a70185c2,e76852a6-1e53-4c23-9730-30e1e64116d4,true,,roe vs wade year,I wanted to check when did the original Roe vs Wade decision happen and how much time has passed since then.,6/25/22 10:05:00
EGZANDYA4C6Q,a4f0fa74-d1e9-4c41-b11f-c92107aaced6,e778f48e-5993-41db-9421-41dcb2d4d3ab,false,,"""I have an IRL problem with someone in the acclaimed""",I was trying to find a specific Reddit thread to confirm a rumor I found on a wrestling message board. I was hoping to find the actual Reddit thread by searching different variations of the text and query.,6/28/22 18:48:00
QD6PJTFGJ63Q,64640ec5-2957-41a5-a9b7-3475363c1e51,e7f3e491-4e20-4400-a57f-687dd2eb7226,false,,banfield west valley,I realized searching for the name of the vet clinic would be quicker to find the phone number.,6/27/22 15:29:00
X6P6DQRXD62A,41cb7983-aa18-438e-8b12-09aa317937bb,e83a6927-91c0-4ee5-b925-6d57882198c5,false,,PS3 Bloodstained wiki,I wanted to find out if the game Bloodstained was released on the Playstation 3. Was sure the Wikipedia entry would have this info.,6/17/22 18:46:00
AZZDZJGYZWJ3,cb715fb5-8a83-4f8e-959d-0b030a55bd77,e83c966d-9f08-4021-b7a7-cb04cb491ef8,false,,twitter,"I was looking to get to Twitter, so I did so via a Google search.",6/27/22 10:22:00
AZZDZJGYZWJ3,20a99a87-bf9f-4a79-986d-1e7b0e87835a,e87527a4-a0a0-48f3-aa20-cd6ffb70497e,false,,Youtube Tag of Zaha Hadid,"I was looking to see if this was a person and also to make sure they had a tag. I was hoping to see that the YouTube tag was the same as a channel ID and that if it was, that it matched with the given one I already had.",6/25/22 12:48:00
4TNHZX6VKQAA,35d0d743-6868-45fa-8840-82bea7d569fc,ea864cc2-d7f7-4c17-a780-9c43b8f3df75,false,,free antigen test government,I wanted to order a free COVID testing kit from the government.,6/19/22 18:48:00
QD6PJTFGJ63Q,c7258919-de4d-403a-b38f-140f4cf857bc,eb1b2b69-949a-40d0-910a-82cb1da3ebac,false,,bpm differences between ableton and logic reddit,This was a search to solve a problem with collaborating in music. I was trying out different search terms.,6/24/22 21:07:00
7R2NKCJQNXPP,4d04e2d3-ca6d-4c46-a71d-ff38c07db757,eb5d98cb-3c2b-4df7-9e06-d90c04c5050e,false,,anoka track and field,I am looking for the rankings from the state tournament from over the weekend. My son runs track and I wanted to see how the team did.,6/13/22 08:15:00
ADCXHGCQRA34,870b8457-970f-4924-a063-8004a4c3ef82,eb8cf28a-3425-42bc-abb9-cccf2b3ebd7b,false,,perfect hard-boiled eggs,I am looking for instructions for making a good boiled egg. I'm hoping it's at the top of the results.,6/13/22 20:02:00
MVMZFQEH2MYN,0a34a682-343a-4d56-99d4-bb6c624cd2ff,eb8f840d-7df3-4366-b6bc-1e2062b0dd5f,false,,golden state next games,I wanted to check the exact date and hour of the next NBA finals game,6/11/22 23:23:00
Y72KN4H9FMJJ,8dbf0834-338c-4ac3-b872-9f215267638c,ec1d987c-2094-4f22-8d5f-b3968a0f259d,false,,how to wrap up wounds with gauze,I'm trying to find the best possible way to securely wrap small wounds with gauze.,6/11/22 09:52:00
7R2NKCJQNXPP,3be7aea8-16fe-447e-aee1-d66a24c44f30,ec539fdf-7573-4e5f-88af-34a2c417488d,false,,Emagine Theaters Rogers,I am looking for the movie schedule for this coming weekend because I'd like to watch some movies as it's supposed to be very hot here.,6/15/22 07:10:00
4TR6J693M9XK,7943f649-ccbb-4c0b-b4e6-2aef674cc111,ec6b2e91-d5b0-4c38-b02c-25f669dcd55b,false,,Cash deposit limit,I wanted to find out how much cash I can deposit at a single time at a bank.,6/21/22 15:03:00
4TNHZX6VKQAA,e1b4bcee-3ad8-447e-be34-49456e9fcd8b,ecba0fd1-abe2-49ba-8966-aa0abcdfab5a,false,,dna diagram,I wanted to see a labeled diagram of DNA.,6/15/22 10:10:00
AZZDZJGYZWJ3,fe115f78-327e-40d3-bac5-e381862b7184,ef5035c4-1af9-48a3-a8c2-7d3a7aa602fe,false,,Resellers Location,"I was looking for additional clarification on resellers. I was hoping to find some info related to brands and locations, possibly to get an idea for a gig work task.",6/28/22 20:40:00
MVMZFQEH2MYN,a9499372-9d23-493d-b834-3fdb2c9addf1,efcabcd7-0503-4223-bec0-6e6fec848dc1,false,,madrid barcelona basketball final,I was checking the results of the 4th game of this basketball final,6/19/22 12:25:00
EGZANDYA4C6Q,921378fc-cdd6-4b21-9494-dfc4bf63b5af,efce4536-a82c-4e4c-866c-e7e8ea4ef0bb,false,,Black pool combat club,My query is the name of a wrestling stable. I wanted to find how many wrestlers are in the stable and what their names are.,6/27/22 15:02:00
AZZDZJGYZWJ3,b5b9fb32-6acf-4d2c-9c87-47f4059e800f,efd3099e-0c0b-4321-837d-2351fa6ff1d2,false,,twitter,I was just trying to get the link to get to Twitter.,6/24/22 18:46:00
MVMZFQEH2MYN,89fba538-1231-45ce-8c30-c4061bd6c946,f0071ee7-55ac-4439-8057-842cb24c7f81,false,,excel subtotal functions,I was looking for the 1 to 9 functions of this formula in Excel/Spreadsheets,6/18/22 01:16:00
AZZDZJGYZWJ3,15ab5c04-b7ce-4bbb-b747-6d52c28a87a9,f01184b5-ad3e-4cf5-a493-c7eaf1024315,false,,twitter,I was looking to get to the Twitter site via a Google search.,6/25/22 07:47:00
6CNHTCG6W6XM,3f5c434d-b0af-4053-b42b-de0eb151d344,f077a6e4-9a75-4b90-9a4d-84aa3ce37b35,false,,myoclonus,I wanted to find out the definition and possibly some images or videos of myoclonus.,6/23/22 11:32:00
X6P6DQRXD62A,d824792e-c050-4733-ad31-685951337290,f07c3bbe-0891-4227-81ed-41f8030a6baf,false,,cardano price coingecko,"I was looking for the price of the cryptocurrency Cardano, and wanted to view the price on the website coingecko.",6/16/22 23:59:00
