7R2NKCJQNXPP,e6ec9988-c5e7-4d10-bac0-694ef9888488,6664a34e-bd50-4268-8013-0157228887f8,false,,Bed in a box,I am looking for a new bed for my son.,6/20/22 08:40:00
MVMZFQEH2MYN,b8ef0944-f1f8-4e45-a729-41ce2f958aab,66a26c63-d80e-4afe-86dc-882f0e5058f2,false,,australia peru final result,I wanted to check which players scored and which one missed on this game,6/13/22 20:21:00
AZZDZJGYZWJ3,a80fcd36-7aea-4d6c-8a27-b7d21cd7e108,670fa79f-3cd9-4680-9628-31b5632cf274,false,,What is in the category of Ernest Renan?,This was for gig economy work. I was looking to find out any result I could that was useful/related to the given answer I had.,6/25/22 12:37:00
ADCXHGCQRA34,419a1040-5864-4fe1-83c2-df383f4b55ea,67409f83-d577-4ac0-a1aa-cc89b11d6ea0,false,,temperature baking Italian sausage in oven,I need the temperature and time to make Italian sausage in the oven. I hope the first result will tell me what I need without clicking on it.,6/13/22 16:00:00
EGZANDYA4C6Q,5183047b-0b1b-46ae-b2fc-d6981bbd15eb,6870aae0-f38c-46fb-829e-39e7939a917e,false,,WWF New York lita stephanie,"I read on Reddit that Stephanie McMahon forced the wrestler Lita had been forced to ""striptease"" at WWF New York decades ago. I was trying to find any transcript from an interview or any additional information.",6/27/22 11:02:00
QD6PJTFGJ63Q,c8c58f04-a4ae-4f6e-9194-804a30d3be7f,68941cd8-0c1f-4bca-b689-5f100982edcf,false,,marbles clock input unstable,I have a synth module with a functional issue. I was hoping someone had made a forum post explaining what I could be doing wrong.,6/25/22 01:08:00
QD6PJTFGJ63Q,5083f42d-accc-4ede-b71e-572cb3780bd6,68f884d6-0ba9-4e0a-a9de-a0656e4779c4,false,,monome crow api,I was looking for an API official documentation page.,6/23/22 22:12:00
AZZDZJGYZWJ3,c6e5b1ff-77e8-434e-a784-3cce89a9b573,69212cb1-a510-4986-b790-57da44f72006,false,,https://t.co/OvuQJew53L,"I dragged this text to a URL bar assuming it would take me to a tweet, but I did not see the n there at the beginning (at least, I don't think). No other intent that I can remember.",6/27/22 13:02:00
AZZDZJGYZWJ3,47645b5c-1e25-4e02-96d2-a8d0e2bf2799,69a68365-69f4-4e5b-853f-cabe8dd532d2,false,,nausea,I was looking for a definition of nausea. I was expecting to find a decent definition that would give me a clear picture on nausea.,6/27/22 16:18:00
QD6PJTFGJ63Q,0d1f980b-6b3f-445d-8506-cdb0ea73d567,6a3e4ac0-970b-4406-9f01-67915bf1211a,true,,forest caver github,I was looking for a particular GitHub repository and I only remembered the user's name.,6/27/22 16:43:00
4TNHZX6VKQAA,15768954-9404-4471-a254-ba34d7b8722a,6af41a9c-8619-4d7a-9dfb-940b1535029a,false,,eye diagram labeled,I wanted to see a labeled drawing of an eye.,6/15/22 09:31:00
7R2NKCJQNXPP,82e12a2d-f071-45df-919f-613882740837,6bc713ce-2b7c-49ba-a625-31334e1a5e57,false,,Mann theatre Champlin,I was looking to see what the new movies were for this coming weekend because it's supposed to be super hot here and I want to find something good to watch.,6/15/22 07:02:00
X6P6DQRXD62A,d6178967-2ee6-4689-ac9a-ac804154bcdf,6bda01ea-d72e-4380-bf19-e6d778e1abc0,false,,full spectrum CBD the entourage effect,"While looking into the best CBD for treating lupus flares, I found several pages mentioning full-spectrum CBD (which contains THC, as opposed to broad-spectrum CBD which does not) works best due to what is called ""the entourage effect."" I wanted to find out what this meant and what exactly the entourage effect was.",6/16/22 19:06:00
7R2NKCJQNXPP,95997fe6-9cf1-46b2-b7d5-b0a820036d64,6bf0e412-ff50-4b52-ad85-e80f686c1099,false,,pop up drain stuck down,I am trying to fix my bathroom sink and looking for solutions to get the pop up drain to open as it is stuck down.,6/15/22 08:11:00
4TR6J693M9XK,7d27f688-e8c0-4604-a14d-80c169b69035,6c07018a-50c9-474a-a257-6da760dee9bb,false,,How to become an underwater welder,A friend of mine is a welder and wanted to know how to learn to become an underwater welder.,6/23/22 19:46:00
NFN2M74RPJ2Q,59e434f4-dcd4-4b30-a601-9c65703d8783,6c19ee52-5613-4003-a4fc-36e53aea84eb,false,,UK vehicle tax online payment,"I needed to find the official website to pay for my car's road tax, which is due to expire at the end of the month. Only the official government website is relevant.",6/13/22 10:05:00
4TNHZX6VKQAA,4cd86b4c-6bca-46ce-ac84-f63ddf0a85ae,6cd593d3-18cb-4964-80a6-a1c4afd727ee,false,,youtube documentaries,I wanted a list of some popular documentaries available on YouTube.,6/20/22 11:07:00
ADCXHGCQRA34,9c41f138-fded-45f0-a649-ff03adc2e332,6cf6fed8-4219-4ed8-b90f-b85f316800ba,false,,When is the third January 6 insurrection hearing?,I want to know when the third January 6 public hearing will be televised live.,6/13/22 13:36:00
4TNHZX6VKQAA,79160c67-df2b-4ad3-b518-15061333471c,6d358a34-658d-4428-a2a0-22746034e062,false,,father's day 2022,I wanted to know which Father's Day falls on in 2022.,6/11/22 15:00:00
X6P6DQRXD62A,1c5ff194-ee37-4e7c-90d5-22177bb16b6f,6db56ef7-e2cf-4ec6-ac29-7b8247e845f8,false,,CBD broad-spectrum vs full-spectrum for lupus flares,"After finding information that CBD has been recommended by several doctors for dealing with a lupus flare, I noticed most suggested full-spectrum THC. I was hoping to find information explaining why they suggested full spectrum CBD over broad spectrum CBD.",6/16/22 18:51:00
4TNHZX6VKQAA,6c09457d-b206-4722-bc4a-5460286f1fe3,6dfcdd2c-ac35-4263-8862-b2b3fd4380c3,false,,slack,I wanted to login to the slack app.,6/14/22 09:38:00
4TNHZX6VKQAA,cb97d1ee-9c56-4d74-a4e0-2acfb279502a,6f049f57-7d43-4b42-860f-7c63377382af,false,,selena age at death,I wanted to know how old the artist Selena was when she died.,6/21/22 23:28:00
6CNHTCG6W6XM,03160daf-9590-4756-8ab0-7b80b2cd5a3c,6f1855a4-c586-4a30-b0de-303b4e32136b,false,,occupational health and safety posters,We are trying to improve our clinic and I am trying to look for an infographic that we can put in our walls for our patients to read while waiting. I am looking for something we can order online.,6/13/22 09:01:00
AZZDZJGYZWJ3,b950611a-4d5e-4d44-aa8b-ca0b235718a5,7027f212-a7ad-4269-9d28-84b822a9d181,false,,twitter,I wanted to get to the Twitter site via a Google search.,6/26/22 08:06:00
MVMZFQEH2MYN,adff76b1-9574-4e81-ae8f-5b0d671489c3,70de7466-51c2-4446-9b19-aef5a28ff272,false,,old parr price,I wanted to check the prices and which supermarkets sell this product near me,6/22/22 22:56:00
AZZDZJGYZWJ3,c60d119f-2a8d-4b04-8f9d-9abef460026c,70e1f57d-49dc-4781-8c71-10f23087b3d8,false,,spheniscus,"I was trying to find a specific Wiki Aves bird ID but was having problems, so I was just going by a similar search.",6/25/22 12:43:00
6CNHTCG6W6XM,f4057da0-7251-4e02-8f19-59138618b6d5,72284ff1-09b3-4a32-ad1d-2c18c9c51da8,false,,fyp tiktok,"I was wondering what ""fyp"" means in tiktok because I often see it in hashtags of videos.",6/18/22 21:32:00
EGZANDYA4C6Q,f0783881-c762-465a-8237-0d9c35918c6e,72c60f8a-72ac-4561-9c21-b42ca07dd6fc,false,,super orange emergen c,I just purchased some at the store at I just wanted to read more information on the ingredients in the product.,6/27/22 05:46:00
7R2NKCJQNXPP,5182ba55-8129-48cb-9889-9a7e814866d8,7319d57a-b467-4487-be01-858d0f57747b,false,,Football gloves,I am looking at different types of gloves for my son for football season.,6/20/22 17:07:00
X6P6DQRXD62A,21d45eed-e8bd-407d-a9ce-ad675ae42c5e,739cb2f4-e57c-41a8-acd3-272a282cfc19,false,,tokyo twilight ghost hunters ps vita review,I am looking for good games to add to my jailbroken PS Vita system. I was hoping to find a review of this game so I'd know whether or not I wanted to download it.,6/17/22 14:15:00
AZZDZJGYZWJ3,aca32954-ad0a-48ff-b038-f5788b9d79bb,73a30410-b345-4890-b573-f97f61714925,false,,q67933857,I believe this was a given answer to something so I wanted to see if any results made sense given the question I was given.,6/25/22 12:50:00
MVMZFQEH2MYN,8febb81f-ea4a-4e85-8c6d-945a1be794fb,7431a2d6-a981-416b-853a-2be7ee7377ab,false,,tarapoto lima kayak flights,I've been checking flights and hotel rooms all day long; just need a flight back home for a certain date,6/17/22 21:24:00
MVMZFQEH2MYN,ce4a8036-07eb-4830-b0e8-19733494c4ea,74575d8f-2b75-4e82-adf8-5a3fc96c804b,false,,median vs average in excel,I wanted to check the differences between both formulas.,6/11/22 01:20:00
7R2NKCJQNXPP,2b82ff67-f1b8-44d9-8f93-2c89c91fc974,74734a03-7ce3-4e6b-8eca-2fa832ee723a,false,,6pm.com deals,I am looking for some new shoes and looking for deals.,6/27/22 10:33:00
QD6PJTFGJ63Q,7db818af-1a7b-4149-a9c5-374fd3b5f2eb,74bffbe2-4727-4952-92f1-616c1defad56,false,,tony jones nba,I wanted to find the Twitter account of an NBA writer.,6/23/22 13:08:00
NFN2M74RPJ2Q,6f246327-d144-4e51-b1a9-5e30fb5477ee,7505af1d-ce37-475e-adf9-dda5c86e15fd,false,,"time difference between UK and Denpasar, Bali",I just need to know what the time difference is in order to work out times to call people. A quick answer would be perfect but any reference or travel site that gives me the details would be fine,6/17/22 21:17:00
AZZDZJGYZWJ3,058c1951-b5cf-49d9-8c2f-cc542b4ba8df,75382740-4a0b-47c5-89c1-71a97c99397d,false,,twitter,I was trying to get through to Twitter via a Google search.,6/24/22 07:23:00
6CNHTCG6W6XM,b0f01160-04ad-4b9e-933b-89dcfb54ee78,7575eb83-cf6f-472f-9253-f6e313e56b08,false,,cbt exam,I was wondering what CBT exam means so I was hoping to find more details about it such as the scope of the exam and the method of taking it.,6/22/22 09:03:00
QD6PJTFGJ63Q,baacbc04-968e-4e02-9b2c-441112927c96,75f53e88-e08c-4d7f-bbe2-2dfcd0a7cf8b,false,,t12 soldering station.,I'm in the market for a new soldering iron. I heard this one is a good one.,6/25/22 23:14:00
MVMZFQEH2MYN,1a2af828-4cb1-4c2d-b605-2b271fe50fe1,76a391ef-35d5-436d-9a63-195472e54227,false,,tchouameni real madrid player,"I wanted to check some news about this football player, how much he was signed for, what position does he play and some highlights.",6/12/22 01:02:00
QD6PJTFGJ63Q,9b820c80-a7ad-40ea-9743-19ad036a9fa2,76d723f9-3c42-4a66-a343-003334e1a550,false,,Aimee Garcia,I was watching a movie with this actress. I thought she looked familiar so I wanted to see her filmography to see if my hunch was correct.,6/25/22 21:25:00
4TNHZX6VKQAA,18ebfbb6-d40f-4af6-a5c7-dbd3b6462eaf,784183f3-b69f-450d-95c9-e2b9a07812d5,false,,feedback loop,"I was looking for the definition of a feedback loop, specifically in the context of medical terminology.",6/12/22 21:16:00
X6P6DQRXD62A,d274dece-d3a7-4950-ad80-fc99f2e3a639,7861dbd9-5bc8-47d6-8d1e-3a8c6d39ef52,false,,nearest ups drop off store,I was trying to find the closest store that would accept a return for a product from Amazon. Amazon uses UPS drop off points for returns.,6/14/22 16:16:00
MVMZFQEH2MYN,5c14cb43-93de-4f32-b8cf-c6ee39a1d35d,789b3eb0-1bdb-46ec-8b44-49eef5362995,false,,deluxe edition tbc includes 30 days,I was looking for an exact answer to confirm if buying a certain product included other items,6/21/22 20:47:00
MVMZFQEH2MYN,2cc5c11e-36a1-4d14-9421-0c4b917d7aa2,78a29f66-5fd8-4e87-8385-1dcb8c0f311c,false,,anthony rendon contract,I just saw some news regarding this baseball player and wanted to check how much time they had left on their contract,6/17/22 17:57:00
NFN2M74RPJ2Q,0843165c-1dea-4d53-8cf1-8ff799c3227c,78a8a181-cdde-4b37-ac4d-2ca471050080,false,,difference between usable and effective capacity,I have come across the two terms while working and wanted to be clear on the difference between them in the context of data center storage - I just need a quick answer or a reference site that can go into more detail if necessary,6/17/22 15:23:00
X6P6DQRXD62A,a23eff7c-1753-4e54-9c15-92e5cef23a53,78c25c7a-7f4b-4ac7-aa01-a825fd1d9faa,false,,CBD for lupus flares,"While researching lupus flares, I found a few testimonials saying CBD had helped people deal with their flare. I was looking for actual medical documentation that CBD might be helpful, not just hearsay",6/16/22 18:41:00
ADCXHGCQRA34,c818a449-cb55-48e9-a8a2-03ea950ac103,79082ca6-9f02-42f0-baec-8ea23458ea6d,false,,where is jurassic movie playing near me st petersburg fl,I was looking for the closest movie theater to me that is showing the new Jurassic Park movie.,6/11/22 09:16:00
ADCXHGCQRA34,7e29215c-5acf-4640-b2ee-3849f01070a6,795a2737-e560-4424-8342-9a4b31614163,false,,isolation vault tier 3,I'm trying to find isolation vault in tier 3 in Warframe,6/19/22 18:39:00
QD6PJTFGJ63Q,99f349d9-9ebf-438e-900d-92d6e9527d9c,798fa52e-f7a6-4416-ba06-3db317e3cccf,false,,sparkling ice lemonade,"I saw this on sale in a Costco circular. I'm on a keto diet, so I'm looking for no-sugar beverages.",6/24/22 11:05:00
NFN2M74RPJ2Q,f9eeae88-3b6a-4d75-b80a-f24896068329,7991ce1e-268d-4fc8-9b62-c469acdc53a9,false,,HP DL380 gen 10 quick specs,I'm trying to find official specification sheets for a Hewlett Packard data center server. The official documentation off the HP site or any other support documents would be most useful but any pertinent details would be welcome,6/14/22 13:46:00
JXPAPGM4VFYE,e499ef34-4692-40fd-ad7b-61e802ee146b,7a6b5067-198b-4237-8101-68f27ea2b355,false,,Free Pearson access code Reddit,I am taking a summer course and I need to use Pearson for the assignments. Access is over $100 so I was trying to look up a code to use.,6/27/22 12:39:00
AZZDZJGYZWJ3,732151d4-39da-48fa-ac07-1750f973aecb,7a84aef4-c40a-4222-bbef-1c83ab500f5d,false,,u00e9,This was something that I saw in a given answer and was just covering my bases. I wanted to see if it meant something or if it was an error in formatting.,6/25/22 12:51:00
6CNHTCG6W6XM,4f2c4f9c-2285-4deb-b85d-118675f20528,7ab3d219-3f11-4a72-ae28-43217a9a708d,false,,spire opd staff nurse,I was looking for a particular job posting in job search websites to find out about the usual salary range they are offering.,6/22/22 11:05:00
ADCXHGCQRA34,8622cb8c-8fc0-4dc7-ae2b-ec06a3ca01d1,7b2a7936-cfb9-41f5-84ca-9db405e36cd4,false,,pcso active calls,I heard sirens and I want to see if the sheriff's office shows any active calls. I want to know what's going on.,6/20/22 12:21:00
EGZANDYA4C6Q,4283b973-f6b2-4670-a2fa-57730c242a4f,7b591371-bdf8-4dd0-94c8-559c7b2fa3a8,false,,"""I have an IRL problem with somebody in the acclaimed""",I was trying to find a specific Reddit thread to confirm a rumor I found on a wrestling message board. I was hoping to find the actual Reddit thread by searching different variations of the text and query.,6/28/22 18:48:00
MVMZFQEH2MYN,b0ac649c-d571-47d5-bb91-0a57c2a962dd,7b9bb6d9-041c-4814-8f12-3e573ba46d16,false,,mlb standings today,I wanted to check how are all baseball teams doing this season so far,6/23/22 00:56:00
AZZDZJGYZWJ3,33e998ee-5321-400d-9a50-0a25864be660,7c1e6f44-b9b8-4346-8890-8a4556134ee2,false,,Wikimedia category for films shot in Lyon,"I was attempting to look again for a Wikimedia category for films shot in Lyon, as I did this same search just a bit earlier than this one. I was hoping to find something that I missed previously, I imagine.",6/25/22 12:51:00
MVMZFQEH2MYN,8c0ea1f4-60cf-43d7-9fd3-9238ed1a58fd,7c238523-1b48-408b-9369-60b744af4c67,false,,lima tarapoto flights,I am keeping an eye on price changes for these flights,6/16/22 14:55:00
ADCXHGCQRA34,84150223-7e56-4844-8498-4211a3d7728d,7cb811a9-9011-4dfa-b1a4-a57d49155815,true,,Dr Sleep,"I want to know what Doctor Sleep, the movie, is about. I hope the first result is the Wikipedia page.",6/23/22 09:00:00
6CNHTCG6W6XM,845ffa09-f638-4310-91f8-601a3a161145,7cfb1976-a2d8-4183-b6ce-c87d1921f3cd,false,,knee psoriasis,I was hoping to find an actual image of psoriasis occurring in the knees.,6/21/22 16:19:00
MVMZFQEH2MYN,3300043d-6545-401a-957c-0303e0986464,7d539d54-5c72-43ab-8bc6-17be964689e6,false,,dean norris on gas prices,I wanted to see the actor's comments on this topic,6/23/22 23:36:00
4TNHZX6VKQAA,d3334790-f43c-4a6a-acd4-118fb1ccf270,7d8fc6a4-599d-47aa-b102-3944d22efa93,false,,tinkercad student accounts,I wanted to know what the TinkerCAD interface looked like from student accounts.,6/15/22 10:29:00
6CNHTCG6W6XM,f29eb923-fff3-4302-b2b8-178b95f002e9,7dff0585-5a88-4265-81a6-b686f0a2b0c7,false,,aldo doll shoes,I would like to access the official website of Aldo and view the doll shoes they have on their catalogue including the price. An online shop with the said products for sale could also be a good alternative.,6/23/22 14:29:00
MVMZFQEH2MYN,4b58111e-7fc1-4297-856f-85d9b4223fdd,7ea801ce-7d08-414c-99d6-0723c2681a33,false,,usd to COP exchange,I wanted to check the actual exchange between these currencies,6/19/22 23:44:00
X6P6DQRXD62A,f256c702-4bf1-460e-9f26-5d4ff6c55cf1,7fe6fd00-a313-4a4e-b115-1acf608c7b28,false,,Ethereum,I wanted to know what the current price of the cryptocurrency Ethereum was at that moment,6/11/22 18:48:00
MVMZFQEH2MYN,22d4fa2b-2132-4b92-9fa8-79ec24d3b897,800e1c96-eb76-4949-8063-1364d555bb04,false,,yankees games today,I wanted to check the exact hour in which this game will be played and vs which team.,6/16/22 20:00:00
ADCXHGCQRA34,ddb6137e-b7e5-4ac7-9eb9-4985858450e5,80380204-d920-4b1f-807b-6374695b5c2a,false,,why are europe and asia different continents,I want to answer this question after getting into a discussion with someone. I want to know why they are considered separate rather than one continent.,6/15/22 20:59:00
ADCXHGCQRA34,635c36ff-8052-474c-9f24-f741c4d1693b,822069aa-bdc0-487c-b69c-aa5b4917eb85,false,,vlad III of wallachia,"Looking for more information on Vlad. I want more details, not on the Wikipedia page. Maybe a research paper.",6/20/22 04:42:00
NFN2M74RPJ2Q,c16a884e-eacf-451d-9745-995aaeea5525,8281f38d-af07-4469-8e5c-77dcc0ca4d02,false,,problems with Philips Hue smart light bulb,"I've got some issues with my smart light bulbs and want to find an, ideally official, support page to help me troubleshoot the issues",6/17/22 21:40:00
4TNHZX6VKQAA,4cd71a38-c3b6-440e-9e1b-bacd57014026,82f5e3c1-831b-4328-913c-4cbe2c156b22,false,,is a virus a germ,I wanted to know if a virus was considered a germ.,6/17/22 08:15:00
4TNHZX6VKQAA,f68c276e-cd74-4eca-babc-87bbb499be13,82fb8669-deee-48e1-b181-3e1deeaaee97,false,,running problems,I was looking for some of the negative side effects of running.,6/14/22 08:01:00
ADCXHGCQRA34,01436027-625c-496e-956c-57a7937f3727,83ecb07d-0edd-4351-9144-d560cb7bdbbe,false,,lambda ai,"I was looking for recent news articles on Google's AI, Lambda. Specifically looking for news about the engineer who thinks it is sentient.",6/12/22 21:00:00
EGZANDYA4C6Q,e1ac445c-3d98-4ec7-b1c2-940636ac3383,844b1fe3-45e7-480a-9dfa-0f1e2019092e,false,,Tippi Hedren,I wanted to watch the movie Citizen Ruth and saw her name. I couldn't remember which character she was so I googled it.,6/27/22 13:59:00
Z99F437AMJC2,fd005cf1-58bb-4817-93f3-6cbf4393c39f,8490ed71-acdf-4244-b83d-112fdab7f06a,false,,22Gz,"I'm trying to find information on this popular rapper, I hope to find news articles on him in the news tab",6/21/22 13:13:00
AZZDZJGYZWJ3,6ca31fe4-b481-477e-9a9e-aa72650b83c2,85364e5b-63d3-4317-b9b0-fb6f8f3d017a,false,,freddie freeman,"I was still looking for information about Freddie Freeman as he was playing his old team. I think maybe this time I was looking for stats/video, or that was the other time, or both.",6/24/22 16:40:00
QD6PJTFGJ63Q,dca92270-5e18-4a08-b013-be08de24a713,85d009b3-323d-41f2-9498-f6280cb6f249,false,,i wanna dance with somebody,"This Whitney Houston song popped up in my head. I wanted to listen to it, I was hoping for a Youtube music video.",6/24/22 11:25:00
X6P6DQRXD62A,56adbd3f-941b-48ce-8c40-a76921478bfe,862b8b7e-f502-4264-8e67-4bcafa0dde83,false,,now you know (2002 full movie),"I was trying to find a download link for the movie ""Now You Know."" A friend of mine has been trying to find this movie and asked me to help.",6/16/22 15:00:00
AZZDZJGYZWJ3,504b9288-4a28-41bb-9af6-799549a4d697,86427080-ecd6-4b72-8ace-044a83f66672,false,,Unz Review author identifier for Sherwood Anderson?,I had a given Unz Review author identifier but I wanted to confirm it through a Google search.,6/29/22 01:28:00
4TNHZX6VKQAA,6efe2066-ab76-4c0e-a62d-debf095ca97a,86450096-94fc-4294-adf5-80c1699f8734,false,,fresh off the boat season 5 123movies,"I was looking for the 5th season of the TV show Fresh Off the Boat, which I wanted to watch.",6/10/22 20:44:00
QD6PJTFGJ63Q,792697ca-ec25-4448-acd6-83409adcac0f,865e4dab-3151-436f-88f6-e210c2a3de5f,false,,nebulae v2 vs morphagene,I wanted a comparison of two different synth modules. They are similar so I wanted to know which one would be better suited for my needs.,6/27/22 10:40:00
AZZDZJGYZWJ3,98248279-2495-41c1-be6c-33a7e21ecae6,865fd228-488e-48c3-856e-1e66b20bc043,false,,world war i,I don't really remember why I searched for this one. I think it had something to do with gig work.,6/24/22 16:48:00
4TR6J693M9XK,9cb6dc4b-ac93-44bc-b51b-84289f8619d0,867b20d1-3b26-4c78-9624-8ba01d44e723,false,,detroit style pizza hut,I wanted to see if pizza hut made a certain style of pizza or if they discontinued it from their menu.,6/28/22 20:36:00
4TR6J693M9XK,c34e0d1c-7c0a-46a8-b7b0-4c7e77bb47ce,867f0034-cb69-4055-997c-2bc73678c0c7,false,,hotel morgan,I searched for a hotel in my local area that I might stay at for a wedding.,6/21/22 16:19:00
4TNHZX6VKQAA,58fe8e8b-b4d3-471c-8378-0aae805fa54e,86e5e38d-811f-4a54-86f2-e73b4e3af135,false,,sake bomb,I wanted to know what was in a sake bomb.,6/15/22 20:30:00
4TNHZX6VKQAA,93def9cb-73fb-41cc-bcd5-95048af7bda6,871bbd5d-bfa5-46bd-84a3-b6674142112b,false,,kanopy,I wanted to access a program called Kanopy.,6/20/22 11:07:00
MVMZFQEH2MYN,38de9861-5ee1-4345-9ed2-6e3e5e8de48b,873fbd3a-8da1-4629-9ef3-4bfaadaeee96,false,,f1 race today,I wanted to check the exact hour of the Formula 1 race today,6/19/22 12:24:00
NFN2M74RPJ2Q,d14d7ddf-ee70-421c-bb1d-1808db32f2da,87485f7d-7eaf-4368-9bb9-f1ac3e122ebd,false,,How old is Penny Johnson Jerald?,"I was watching the latest episode of 'The Orville' with my wife and we got into a discussion about the actors and I knew this particular actress was older than she looks, while my wife didn't believe me, so I looked her up.",6/12/22 20:49:00
QD6PJTFGJ63Q,adbee9f9-44da-4113-b222-0bbfbb3796b3,8771ca1a-ccb2-4cf4-9946-c3c806362f26,false,,how to program an stm32,I wanted to see what the process is for programming a particular microchip.,6/23/22 18:29:00
4TNHZX6VKQAA,14d93f11-df39-488d-8008-c261f636b6ec,87d1fcc8-1a6b-4303-93fd-3ab44efcc573,false,,standard deviation formula,I was looking for the equation that defines how to find the standard deviation of a data set.,6/14/22 15:48:00
MVMZFQEH2MYN,3145367f-71b0-4036-8da4-0a6ad34bcb68,87f0dfa7-5eb2-47b7-9d89-31a78403d1f4,false,,conditional formatting highlight row,I wanted to check the formula to add a background to the entire row using a certain keyword,6/21/22 16:48:00
QD6PJTFGJ63Q,23aca035-4b70-45a9-be25-1ebfcbc0634e,883c80bb-47ae-4750-b533-dc2403cb4d3e,false,,dirtywave m8 manual,I have a new music toy and I wanted to download the manual,6/23/22 23:58:00
6CNHTCG6W6XM,2d6e4bc6-cc8d-469b-b7a8-b4788ead66b2,884ca637-3284-4ad4-b8a9-2f0135f63536,false,,peeling of skin on fingers,I wanted to find out more and preferably have a list of diseases associated with the said symptom.,6/21/22 13:59:00
4TNHZX6VKQAA,ea3d3ca8-8fbc-4bdd-97c2-a87ac385bfd3,889eee9e-743d-44bf-8bff-fdb4de0997f6,false,,r kelly age,I wanted to know how old R Kelly is.,6/19/22 17:00:00
ADCXHGCQRA34,826e01b8-5e3c-4d96-a3f0-c2c1d0e97bed,88ac373e-7847-4919-9abd-1abcc6e2f1f7,false,,See clickfix,I was looking for the website to report code violations to code enforcement.,6/18/22 21:00:00
JXPAPGM4VFYE,b31d4324-931b-4de7-9b0b-1472ba52b7da,88d36ebb-9b83-4618-93eb-283db6efffd6,false,,Fogo de Chao steakhouse dc,I wanted to find the address of the Fogo De Chao steakhouse in Washington D.C.,6/28/22 11:36:00
AZZDZJGYZWJ3,3094bb64-6245-4f21-82c7-d4e1853ae359,8900f2d0-ae8b-4ac6-b1ca-a796ea712b5d,false,,twitter,"I was looking to get to the Twitter site, so I did so via a Google search.",6/26/22 22:24:00
4TNHZX6VKQAA,55a9ef07-bc6c-491c-a0c9-f1cb232183b8,89386a81-8c4b-498a-86aa-12284aca8d84,false,,maximum pulse,"I was trying to figure out how a person calculates their maximum pulse. Specifically, I was looking for the equation that uses people's age to find their max pulse.",6/12/22 16:28:00
MVMZFQEH2MYN,4f98260f-441d-4854-8cb8-3d84d89fe9ad,89590ea9-d475-4de8-bd07-a24b57329a92,false,,countif function in excel,I wanted to check how to use this function properly in a Google spreadsheet,6/24/22 10:26:00
X6P6DQRXD62A,081a925b-9163-4949-97bc-f7f6dd58ab47,8987d743-4f44-4766-827e-469d2768db90,false,,blocking youtube ads on firetv,"I wanted to know if it was possible to block ads on Youtube videos on a Fire TV, as my mother hates having to watch them. Was hoping to find either an app or instructions on how to block them",6/20/22 07:15:00
MVMZFQEH2MYN,072db734-89ac-4580-b19a-392ca32b913e,8ac7fb67-2d72-4759-b117-abe8b0ce0db1,false,,ipv4 vs ipv6 comparison,I wanted to check the differences between both IP systems,6/18/22 04:17:00
X6P6DQRXD62A,eda3239f-492a-4e92-aa78-09785022dd8d,8af2edbb-e293-4ca8-a5e1-b1c05af11818,false,,easing lupus flares,"My mother suffers from lupus and is regularly hit with what are essentially attacks caused by the disease known as ""flares."" I was trying to find information on what I can do or what meds might help to make her more comfortable when she is flaring, as it makes it her feel absolutely terrible.",6/16/22 18:12:00
QD6PJTFGJ63Q,6a9dd7c7-5148-4c64-8906-4dce73ccdb87,8b07c6c1-35c4-473e-8503-ec70b1cfda32,false,,norco game,I read about a game and I wanted to see more information whether it was a review or a video.,6/28/22 00:53:00
4TR6J693M9XK,6f780494-81d4-4136-bd6a-6f3b1da82d49,8c072ac9-b60d-45b0-912d-86d493a79148,false,,How long does it take to get contact lenses,I am wanting to see an eye doctor to get contacts and want to know how long it would take to get them in the mail.,6/24/22 07:02:00
