worker_id,task_id,task_response_id,is_reviewed,review_score,Enter the query you searched for.,"Please write 1-2 sentences to describe the intent behind your query. Example: ""I'm trying to find a service that can deliver flowers in the Cincinnati, Ohio. I'm hoping that the first result will be a reputable business that is reasonably priced and can deliver same-day.""",Please enter the date and time of your search.
AZZDZJGYZWJ3,a5d036bc-a7a5-4e59-9ff2-74514c1e15d1,0345f30f-210f-4823-a103-24efb68bf835,false,,twitter,I wanted to get to the Twitter site via a Google search.,6/26/22 11:08:00
ADCXHGCQRA34,c7385518-5b13-4ba0-a044-a3f0a5a6676c,04668568-0e73-4cbe-8f95-b44d4e4ec716,false,,who is Ray Epps,I keep reading comments on Facebook referencing Ray Epps and the January 6 Capitol insurrection. I want to know who this person is.,6/13/22 20:18:00
JXPAPGM4VFYE,0754e5fd-2968-45d5-b0fb-09f7dd61f88d,057b2287-1ec0-43aa-99d5-12673f1b911d,false,,Sweetfrog near me,I was in DC and looking for the closest Sweet Frog to where I was located.,6/28/22 13:15:00
Y72KN4H9FMJJ,3e883ae6-5abd-4c06-96cd-7be553f0070a,05a058b0-f120-4fb3-b966-d00ae4433560,false,,neosporin for open wounds,I'm trying to find out if neosporin is a good over the counter treatment for small open wounds.,6/11/22 10:02:00
6CNHTCG6W6XM,8e67018c-eb35-4f23-9364-a8f09a5ed022,067ece29-858b-4a8b-8bec-be6bd66f739a,false,,coffee project menu,There is a newly-opened coffee shop near my place and I wanted to find out what is in their menu. I was also looking to find out more about their price range.,6/14/22 15:59:00
AZZDZJGYZWJ3,a086e4c0-48c5-4c34-905c-458e66552b99,06b567a9-a69b-40b1-ad7d-189b53b4e44b,false,,Which is the UMLS CUI for standard genetic code?,I was given an answer to what the UMLS CUI was and I wanted to see if that answer could be confirmed through a search.,6/29/22 01:20:00
4TNHZX6VKQAA,2c25ff47-8937-4fa9-b4e7-6edb01fb1a85,06b94cee-b0e6-4cad-96ef-0e088ef113d1,false,,cobra farm,I was looking for an image of a cobra farm to use as a reference for an animation.,6/22/22 13:39:00
MVMZFQEH2MYN,a2c57d37-7509-44d9-aec0-68dc5c3e3319,06ee1b6f-d45a-4fc7-a923-1fc459c25925,false,,devs hbo netflix,A good friend recommended me this TV series and I wanted to check where were they streaming it,6/17/22 21:25:00
NFN2M74RPJ2Q,37b42d3e-c231-431e-8f96-7a7357fa3c32,07702ea6-6bf7-4ae1-b0f3-9be786f9b1ce,false,,good ways to keep cool at night,"It's been a hot period recently and tonight is the hottest day of the year so far - I'd like helpful hints on how to keep cool at night and sleep better. Official health sites, general Q&A forums on people's own tips and everything in between will be welcome.",6/17/22 22:17:00
4TNHZX6VKQAA,e92eeba7-3e00-4407-934d-61b4bea27873,081d9269-d586-49db-bf56-bab3f8d869be,false,,delhi british colony,"I wanted to see what Delhi, India looked like when it was under British reign.",6/21/22 23:06:00
X6P6DQRXD62A,12a771fb-ca14-4e58-aa6e-42f503619fb0,08e72d8b-b653-4f00-90d6-f624a40d752d,false,,Next postal holiday,I wanted to know when the next postal holiday was coming up due a package showing a later delivery date than expected. Was hoping to get a knowledge box with a list of holidays,6/17/22 11:57:00
X6P6DQRXD62A,423c2d0d-7aa4-4047-a9c5-82567eba30de,09745f78-22ab-4dcb-8bbc-720e341cc40a,false,,cardano price,I was looking up the current price of the cryptocurrency Cardano.,6/13/22 18:11:00
QD6PJTFGJ63Q,39f572bd-41be-439b-82ae-d632a13e5473,0a0b9f58-f09a-4203-89e3-733b43fba87f,false,,Knob Farm Hyrlo,I saw this module on sale on a forum. It was a good price so I wanted to see more detail to see if I could use it.,6/25/22 13:55:00
ADCXHGCQRA34,da18bbc4-5a9d-4be5-b0b6-26d5d13eafb4,0a0d10e2-77b1-43a9-9d90-f7f7a2fb955a,false,,Jesse Tolin death,I am looking for a death date for my grandfather as we are working on the family tree. I am hoping I get a link to vital records where the death occurred.,6/13/22 21:15:00
4TNHZX6VKQAA,ee0c0d08-0812-432b-839e-d3bb8b0ce2e7,0b38ccfb-d1e2-4778-b9a1-45b1d12e3179,false,,conflict immunity biomanbio,"I was looking for an online game called ""Conflict Immunity."" It's on a site called biomanbio.",6/17/22 10:49:00
QD6PJTFGJ63Q,52275612-d1d3-46f8-b96a-e9ce6eb37800,0c25dd65-15de-4780-8958-4653885c254b,false,,ornament and crime arpeggiator,I have a synth module with multiple functions. I wanted to see if it had this particular application.,6/24/22 20:29:00
EGZANDYA4C6Q,ad0d4435-4703-424a-ad65-e3233deda617,0c7f4f6a-7066-43a8-b86c-9a56189f59b8,false,,adam cole,I read the wrestler Adam Cole had been injured at a pay per view the night before. I just wanted to see if I could find any information or the video showing which part of the match it happened.,6/27/22 14:46:00
MVMZFQEH2MYN,fa3b49a2-2838-4153-ab3e-e26aeb91bd47,0d56eb54-80ab-41ac-8e00-7673ba7dd490,false,,lima tarapoto jetsmart prices,I ended up deciding to fly on this airline; just wanted to check a couple of things before buying the flight tickets,6/17/22 23:04:00
AZZDZJGYZWJ3,15c1a904-8ab6-4789-a472-25cebe5f6beb,0d94c73c-8c42-4270-934e-8cf62c922411,false,,freddie freeman,"I was looking up information regarding Freddie Freeman, who was a baseball player. He was playing his old team.",6/24/22 16:39:00
AZZDZJGYZWJ3,317d19de-a98d-4321-b2e6-52ccbd7547f6,0d9eb0a0-e0fe-41c9-9cdd-776fb69463a6,false,,county of Saint Lucia national cricket team,I was checking to see if the county of the Saint Lucia national cricket team was the same one as the one that I was given.,6/25/22 12:54:00
AZZDZJGYZWJ3,10267fc9-4d5e-4eb6-9066-99ebab8527f7,0e3d7d5e-1bc3-4210-aa1d-0cced8a580be,false,,Unifrance company id for NHK,I had a given answer in place for NHK. I was trying to do a Google search with this criteria to find if the correct answer was the same as the given one.,6/25/22 12:40:00
4TNHZX6VKQAA,fae33b12-d71a-40ae-a6a1-abe31dd947f8,0fa48024-0a8f-4b94-a105-19bfb87d5051,false,,cobra skin,I was looking for an image of cobra skin to use as a reference for an animation.,6/21/22 23:23:00
4TNHZX6VKQAA,6de6d0a7-614e-4225-9a78-57f9067dfbad,0fd7f7ce-d6be-4eba-a0e0-f0fab8e1cec2,false,,slack,I wanted to login to my Slack account to check notifications.,6/13/22 15:05:00
AZZDZJGYZWJ3,183b378b-a215-466e-a986-757f50495219,1042a139-39b6-471e-b97d-7576b769764d,false,,county seat of Atlanta called,I wanted to find out what the county seat of Atlanta was called. I was hoping to see if I can find an answer that verifies or disproves the given answer I had.,6/25/22 12:55:00
NFN2M74RPJ2Q,a8e7b977-3981-4016-9bf6-ccc2edef84c8,105ef8f4-b4ac-4076-b393-0b80c8e9ed5d,false,,solar panel installation costs,I'd like to know what the costs of installing solar panels would be on my house - I'd like official installer websites for companies local to me and also some reference sites with a good level of information on the process and pros/cons,6/20/22 22:07:00
6CNHTCG6W6XM,84d54752-1e14-426f-a701-ffd4acef2f0c,113c46e1-d1af-4008-be3b-34c3ccb251c1,false,,bdo online banking app discontinuation,"I received a message from my bank that they will soon discontinue their services on their online banking application. However, they did not give further details about it so I wanted to find out more about the reason for it and what options I have given that I am heavily dependent on their app.",6/12/22 10:09:00
6CNHTCG6W6XM,6b522989-bdf4-4893-b027-9d1fe21a6094,11b7c318-4707-4038-a0be-183e2972f810,false,,infj-t,I came across a personality type which is INFJ-T and I was wondering about its description.,6/18/22 14:22:00
ADCXHGCQRA34,a147ae29-fab8-4f89-831a-b09cb14fa8b4,12098a1e-d542-4d79-a537-5ed9b357a97a,false,,timberline glamping,I am looking for a glamping company close to my area. I am looking for the price per day and where they are located.,6/13/22 17:40:00
X6P6DQRXD62A,db2e685c-b011-4112-82b9-5708bbf63760,120b6fef-1553-4e11-85dc-3e1824dd2eaa,false,,Xenon Valkyrie+ PS VITA,I wanted to know more about the game Xenon Valkyrie+ for the PS Vita. I was hoping for a review of the game and I found several,6/19/22 08:15:00
ADCXHGCQRA34,e0dfc31c-3029-44ea-a09b-9d57c9312a88,13120c8e-3fd9-40ee-bb7a-ed450a3a0079,false,,does south carolina have rattlesnakes,I want to know if South Carolina has rattlesnakes. A simple yes or no answer in the results will suffice.,6/22/22 18:39:00
AZZDZJGYZWJ3,d59b3bcf-e16f-4bea-aa50-1a4fee8ec44c,132cf854-e36b-49f8-a964-4717acaa8156,false,,twitter,I wanted to get to the Twitter site so I did a Google search expecting to see Twitter as the first result.,6/27/22 20:18:00
AZZDZJGYZWJ3,697e012d-3324-41aa-9d15-bddba757e7ef,147fe7a7-d495-46f9-b686-0838383f0e2d,false,,Wiki Aves bird ID for Spheniscidae,I was checking to see if the bird ID matched what I was given already.,6/25/22 12:41:00
7R2NKCJQNXPP,8f73dfe0-f376-49da-ab30-bcddb242f910,150624a9-4120-49f3-a887-c1556ccfeaca,false,,Pot roast in oven,I am looking for a pot roast recipe to make in the oven.,6/18/22 18:57:00
4TR6J693M9XK,fad154f0-cb39-448d-a220-776968399c60,15b5da43-a900-4c70-ba9e-5caae83fca75,false,,reddit,I wanted to navigate to reddit just to browse the home page to see anything interested posted today.,6/21/22 16:46:00
QD6PJTFGJ63Q,a4ffff6d-3e86-45ff-ab8b-6748102d8cf4,16904958-73ba-4fdd-ab90-285a08534258,false,,i cleaned out my ears and now everything sounds loud,The question basically boils down what I was looking for. I was scared that I had damaged something.,6/25/22 12:07:00
4TNHZX6VKQAA,1a4b27e0-31ca-47c6-a00b-ec43a0e79142,169d218e-4be2-478e-9919-1beda83ce06d,false,,for how long are you contagious with covid,I wanted to know if the timeframe of having COVID symptoms is similar to the timeframe of being contagious.,6/21/22 10:09:00
EGZANDYA4C6Q,d736eb38-e347-4035-a45b-07cffbbc006d,1732c934-a161-43ea-92b4-765776bfc7cd,false,,i have an irl problem with someone in the acclaimed reddit aew,I searched text from an alleged Reddit post in hopes of confirming a thread does or does not exist. I was hoping to find the actual thread this text was written in.,6/28/22 18:48:00
ADCXHGCQRA34,3e590f20-bce1-4415-8a51-967e44ca026f,18197da4-78ec-408f-87c7-1fc3bcd41b39,false,,does kohls have ovens,My oven is falling apart and I am starting the process for shopping for one.,6/20/22 12:02:00
AZZDZJGYZWJ3,15931fb8-3ba2-4346-bfc9-1ff634405e5d,187bad61-9d63-47ba-93a0-15c3a7314ee2,false,,what antidepressants are maoi,I was getting sick and I am on antidepressants. I wanted to see if the antidepressant that I was on was an MAOI to see if it interfered with the Delsym that I wanted to take.,6/26/22 07:33:00
6CNHTCG6W6XM,31ea437f-1773-434f-ae53-ec00654a42fe,18f760b0-03a0-47e8-82ad-f753a2001bfa,false,,25655 pounds to php,I wanted to know the conversion of the amount to my local currency.,6/22/22 12:49:00
4TNHZX6VKQAA,b31c4d8f-ef17-41f0-97d9-c1f9cf1e5b78,1901242d-ccba-4c1c-8eaa-1e4ae25f140a,false,,pucallpa,"I wanted to double-check the spelling of Pucallpa, a city in Peru.",6/11/22 19:10:00
AZZDZJGYZWJ3,56c8163c-fc0c-49e0-8b8b-f59ead88ffa1,19258e7d-b820-49e2-95ca-9dcd4bf39a52,false,,twitter,I was just trying to get to the Twitter website through a Google search.,6/24/22 01:41:00
QD6PJTFGJ63Q,d7c90a1c-298c-4081-8740-fcf5cd3f8c65,19668191-5980-4d22-85fb-f5745718efe6,true,,just because i love you don't go breaking my heart,"I heard a song with these lyrics, but I couldn't find my phone to Shazam it. I was hoping I could identify it with just these lyrics.",6/23/22 11:45:00
6CNHTCG6W6XM,7e0c4167-8d32-475c-a5c7-1be9cc70d7bb,1988561d-eae3-4b68-9495-9eb28057440c,false,,calcinosis cutis,I wanted to have more details about this disease that I came across in my readings since I am not very familiar with it.,6/21/22 13:59:00
QD6PJTFGJ63Q,bdbf62a4-2b1b-40b0-909a-14e1cfeb286d,19b2e41b-5d55-4c86-a318-6b2b22cc14c7,false,,petsmart,My dog had an appointment and I needed to call the vet first.,6/27/22 15:29:00
MVMZFQEH2MYN,2c145b74-0628-4c20-8164-4b5b7bbd2f5d,19b5a5d5-0139-46e8-be5a-cbbe5b76f76b,false,,mlb games today,I wanted to check which teams were playing today in the MLB and the exact hours,6/25/22 16:36:00
AZZDZJGYZWJ3,c1c73451-6489-4b0a-b498-2867893cc946,19fd61bc-e764-42a6-8ee1-c1bd4fe7bd01,false,,county of the road whose route end is Pahang,I was given an answer to this question and I wanted to verify that the given county was true.,6/25/22 12:54:00
6CNHTCG6W6XM,f62dbfeb-0b56-4ded-b53f-5275c2b4c46d,1a1a3927-ca6e-4f50-991e-09afb42404a3,false,,nmc uk,I wanted to access the Nursing and Midwifery Council website of the UK. I was hoping to get the actual link in the top of the searches.,6/22/22 11:25:00
4TNHZX6VKQAA,a3afbcdc-3695-47e5-842b-c645adcb0778,1a58d3a3-87c5-4982-9752-165eb1cc1014,false,,wolf sitting,I was looking for a reference image of a wolf sitting for a short animation I was developing.,6/21/22 10:35:00
AZZDZJGYZWJ3,13d592f2-a851-45a1-8c35-29d94f69dce6,1ad7ae6d-413b-4f40-9ae5-8da7d1772844,false,,twitter,I was looking to get to the Twitter site via a Google search.,6/26/22 16:12:00
4TR6J693M9XK,f29cd09c-249b-4301-b58b-90f3afbd90eb,1ad871e9-8517-4d8a-9007-7654ddd516be,false,,opti free or bio true,I recently got contacts from an eye exam and wanted to see which contact solution is the best.,6/28/22 20:24:00
AZZDZJGYZWJ3,5fcaba0b-3cbd-4355-94b2-18a592efafe9,1c81578c-5fba-4cf2-b6f5-7a67d0c93131,false,,air force one 1,"This was a mis-type. I was trying to add 1997 or click something that autocompleted to 1997, and it was for the movie that came out that year with that title.",6/25/22 07:22:00
7R2NKCJQNXPP,7e626412-8a4c-4721-b602-b790cb3c1318,1cc8235f-09b6-4a6e-8ed4-add2b29d66a2,false,,Hummus recipes with lemon,I am looking for a hummus recipe with lemon.,6/28/22 19:48:00
AZZDZJGYZWJ3,2009c5e6-91ce-4d72-ba02-70ab7e932ecc,1d428fdd-bcee-45f7-8a4a-d6acace2022d,false,,resmed cpap not turning on,My CPAP machine didn't have power. I wanted to see what possibly could be causing the issue.,6/24/22 18:59:00
X6P6DQRXD62A,134dbae4-c523-4702-8812-213d7c436d35,1f9fca6f-1e22-4a75-ad4f-253ec61bd629,false,,PS3HEN instructions,PS3HEN is a method of jailbreaking the old Playstation 3 console. I was looking for the instructions as I had neglected to bookmark them before.,6/14/22 23:42:00
6CNHTCG6W6XM,3dcc576d-4e42-4fbb-99dd-d8fed1f90471,1fc6c175-a2ec-4200-b8e4-0e666931de61,false,,Hounslow and Richmond Community Healthcare,I wanted to find out where this particular institution is located and possibly more details such as its facilities and infrastructure.,6/22/22 09:04:00
ADCXHGCQRA34,9138c3ea-2209-4427-8488-ea96b80022f3,204c54fb-2304-49fd-ac82-a7a6c1cfeb05,false,,Vlad the Impaler,"I want more historical information on Vlad the Impaler. The true history, not the convoluted one. Maybe a Wikipedia page.",6/20/22 04:40:00
AZZDZJGYZWJ3,6152b669-a6cf-4a28-849e-6e02a2dbec86,206b2853-a74d-4df5-b7a5-4a3164f98604,false,,good omens season 2,I was listening to an interview with David Tennant and they were talking about Good Omens. I wanted to know more info about the series.,6/27/22 23:09:00
QD6PJTFGJ63Q,42990c56-288d-412f-981f-07a03fdcf927,21077158-f840-46a2-a84c-2664bacfa019,false,,noiiz,"Noiiz is an audio sample platform. I knew I had a membership, but I wasn't sure if this was the actual name.",6/25/22 12:54:00
ADCXHGCQRA34,af4b92a6-f6f2-4841-a08a-a11abebf7329,215e38b6-2c05-4e76-ae40-d454ac237a69,false,,Reviews for Neptune restaurant,"I want the reviews for a restaurant called Neptune in Gulfport, Florida",6/18/22 06:06:00
NFN2M74RPJ2Q,5142b601-2eb7-43be-8707-9e5af97bdc9f,219058c1-c916-43c2-b40c-29845f6d894b,false,,opening times for cinnabon monks cross york,"I was watching tv and Cinnabon was mentioned so I'd like to know when the nearest store to me is open - the official site would be good but I also like the Google information panel that comes up with lots of detail like when the site is busy, etc.",6/15/22 21:59:00
ADCXHGCQRA34,b8747e0a-aec5-4939-a631-c5a917883649,21f8f9f8-e619-4d71-8929-7c64d75bffcc,false,,Affordable Connectivity Program,I am looking for details for the Affordable Connectivity Program from the government that gives free or reduced cost internet.,6/13/22 17:39:00
4TNHZX6VKQAA,2885fc3d-bbad-46e4-b000-19fd533da37e,2203f581-353d-43f0-b655-9812f0916edc,false,,lax rideshare,I wanted to know where the rideshare pick-up is at the LAX airport.,6/17/22 22:39:00
6CNHTCG6W6XM,1a9a4133-9e63-40e4-ba58-5b0c1b76b8aa,226c3913-2ed9-421e-82f8-25897ce6a978,false,,trypanosoma cruzi chagas,I wanted to confirm whether Chagas disease is indeed caused by an organism named Trypanosoma Cruzi. I am currently studying for a medical-related exam and the reading materials I have did not mention this correlation but in my previous studies I believe it was mentioned.,6/11/22 22:54:00
7R2NKCJQNXPP,917a1bbc-7899-4180-b194-43bc8fe58c92,234fea31-adcd-4372-8eb2-d0c0268f7b6f,false,,Papa Johns pizza coupons,I am going to order pizza for dinner and wanted to see what coupons they have available right now.,6/15/22 12:51:00
Z99F437AMJC2,070994c1-9389-4f77-a4bb-fb33c87c2ef6,23b921de-48fe-4c4d-9760-674fea4b035f,false,,gangster disciples,"I'm trying to find information on a gang, I hope to find the Wikipedia article for it and maybe some helpful videos and articles",6/17/22 19:15:00
Y72KN4H9FMJJ,033f57ad-9ee1-4a5d-97ab-2b49a8db43c7,2464b55d-8a75-4bda-b374-0f0a0abac38f,false,,broken clavicle after surgery treatment,I'm trying to find information on how to care for a broken clavicle after surgery is complete. I'm hoping to find general information about this so I know what to expect once my boyfriend goes in for his surgery.,6/11/22 09:29:00
MVMZFQEH2MYN,18129ec5-8673-41d6-9e4f-9093fb2e1edd,25073cd5-8c41-4f84-8074-900d28ad9445,false,,houston new york today,I wanted to check the results of this MLB game today since I couldn't watch it live,6/23/22 22:19:00
4TNHZX6VKQAA,54f73f7f-4ebd-4b24-a7b8-dd4c18ec77db,2548892b-febf-40e1-89c6-fb6e62407ec0,false,,dna diagram,I wanted to view a labeled diagram of DNA.,6/17/22 08:05:00
QD6PJTFGJ63Q,755724f7-d847-4590-9b59-99452b5a36b2,2558a4fc-b527-480e-a20f-f74df13130d4,false,,gimp fuzzy select tool,"I was following a tutorial, but it I wasn't sure what the fuzzy select tool looked like.",6/25/22 14:23:00
4TNHZX6VKQAA,e13da101-7da0-43d7-adc2-d6ec09ffca1f,25e946a1-1df7-464c-b435-1af4e6430fca,false,,what does tinkercad look like,I wanted to know what the interface looked like for TinkerCAD.,6/15/22 10:31:00
MVMZFQEH2MYN,126de66f-815f-4c47-b75a-5c5930fb41ce,25ee41a1-fb65-4f24-a927-a52f202a5516,false,,dragonflight changes,I wanted to check the major changes and updates of a new game coming later this year,6/23/22 13:58:00
X6P6DQRXD62A,eeb89b06-6061-4587-8509-ff7293c35508,263c2949-400e-4f9f-826b-8dd7bc4321fd,false,,maximalist,"I was looking up the definition of the word ""maximalist"" after hearing it used when discussing Bitcoin",6/14/22 10:57:00
AZZDZJGYZWJ3,05070e6d-3a08-410a-8bb5-ffe8590b75b9,274ac085-a86e-4659-b7d2-3af276717aa3,false,,twitter,I was trying to get to Twitter via a Google search.,6/24/22 11:44:00
AZZDZJGYZWJ3,cea5920e-eada-45db-8613-cf0c88cedb3c,282ea907-5c63-468d-a201-4bac1365b915,false,,sby2DTTM2_Q,This was the given answer to something. I tried to see if this could lead me anywhere as a previous related search didn't turn up too much from what I can recall.,6/25/22 12:49:00
ADCXHGCQRA34,70240e51-a64f-4857-b66c-5c649382ec4f,28adbaed-d3f7-46fc-86f6-0fb10497ff71,false,,when is steam summer sale 2022,I want to know when steam is having their sale during the summer.,6/22/22 04:27:00
ADCXHGCQRA34,0f1f2799-2f32-4590-b305-b1942453495f,28c877a2-2e5a-4165-8c5d-709f1b39faa3,false,,project zomboid sale,I want to know when project zomboid is having a sale.,6/23/22 01:40:00
QD6PJTFGJ63Q,a39a15bd-3619-4a6b-8cae-8673dc1f3fb8,2976ae24-8c73-4a47-a326-42ff8588aca3,false,,8018401858,I received a phone call from this number. I do this sometimes to make sure I'm not answering a spam call.,6/25/22 11:42:00
7R2NKCJQNXPP,3626d001-5889-43fd-ba89-a1bfc0796d00,29aa7ae9-9194-4fcb-97b2-dee014534184,false,,Twists for natural hair,I am looking for care tips to help my son care for his hair.,6/16/22 08:50:00
AZZDZJGYZWJ3,1b504398-43f9-4dc3-b85e-96954695dc7a,2a2c927b-1c32-4f89-a511-3edec373a062,false,,"Wiki Aves bird ID for ""Spheniscidae""",The result was more specific than the previous one I just entered as I wanted to make sure the last word was included in the results. The intent was to try to find if the bird ID matched the given answer I had to begin with.,6/25/22 12:42:00
EGZANDYA4C6Q,e5c256c5-97ac-481e-965f-0b2108942722,2a6c1e88-e92d-4412-852a-77b674543174,false,,citizen ruth prime,I was searching to see if the movie was available on Amazon Prime. I was expecting to find the actual Prime website at the top.,6/27/22 13:58:00
AZZDZJGYZWJ3,563f4d2c-560e-446b-82cc-7880cabc8b89,2aa82934-380c-4018-a737-b4790b22c9de,false,,Category:Films shot in Lyon,"I was looking to find this result on Wikimedia, or something similar at least. It's an offshoot of another search made, ""Wikimedia category for films shot in Lyon?""",6/25/22 12:46:00
6CNHTCG6W6XM,ddfbd5c8-91b3-44b1-a49d-29c022a0393c,2b251e50-0b9f-41d7-ad31-1e588e380929,false,,band 5 nurse salary,I wanted to find out the usual salary for a Band 5 nurse in UK. I am hoping to get an annual as well as monthly compensation range and if possible including the breakdown of the salary.,6/22/22 12:49:00
MVMZFQEH2MYN,950cb942-f48d-40a9-b80e-c1adc1e7c1f4,2bff92c8-7f13-435f-9df9-ffce917cfc41,false,,tiktok downloader android,I wanted to check some apps for Android that allows me to download these videos from TikTok without watermark,6/13/22 20:56:00
MVMZFQEH2MYN,72782ae8-b3a2-4ad7-a08c-eb82b0ad8d9e,2c312cc7-9e09-4bf1-8665-b0e4a829bf49,false,,intervention vs endpoint,I wanted to check the differences between both concepts in a research or paper context.,6/11/22 12:52:00
EGZANDYA4C6Q,9e203942-1a86-40bf-8a25-c17b139073fa,2c8f44b0-7dba-4c0f-af31-5de642e8201e,false,,labrum,I read online that a wrestler was suffering from a labrum injury. I just wanted to confirm which body part that was.,6/27/22 14:49:00
MVMZFQEH2MYN,98a5597f-79ea-47bf-bd6f-8c521a26e376,2ca668e1-5cc5-4f25-8f8c-e970d057514c,false,,find minimum value with match index,I wanted to check the formula to return the value of a cell when it matches a certain criteria in other columns,6/17/22 23:30:00
ADCXHGCQRA34,4951c357-fa67-4962-b90b-401f3aef3b16,2cf7b418-bcbb-4825-bd60-9760ebe1f76e,false,,how to reset helminth secretions,I'm looking for information on how to reset helminth secretions in Warframe.,6/18/22 18:40:00
7R2NKCJQNXPP,4d0e239e-6324-4ef8-9fe8-def53e792cda,2d35c111-d346-46a6-8e58-76bd38cbedc5,false,,Panda Express menu.,I was looking up the menu because we are going to eat there for dinner.,6/18/22 14:14:00
MVMZFQEH2MYN,c15be0a6-2e86-4749-b5a9-e6759a6a4c5f,2d9a85f4-0ac8-4883-8f6c-48e26d3d2645,false,,madera labrada lodge reservations,I am planning a week vacation in this city and wanted to check hotel prices to compare with other options,6/17/22 10:47:00
QD6PJTFGJ63Q,6c96fb14-f4a0-4d80-a08c-80ad62c2b7ac,2d9da64d-f6b0-4994-a161-eee7eb098544,false,,Winterbloom Modular.,I heard about a modular synthesizer company. I wanted more information about their products.,6/25/22 23:45:00
4TNHZX6VKQAA,65ec35f1-e6cf-4cf5-95a0-bb6b67a0ac57,2e046eac-1662-4aa8-b227-da955bfb5975,false,,Kahana Point,I wanted to see if there was a trail at Kahana Point (in Maui) and if there were other activities nearby.,6/11/22 15:11:00
QD6PJTFGJ63Q,b1d8870b-e123-475c-9718-611d8233d41f,2f1727e4-082a-490e-9fa6-48d36c3d79d1,false,,ADDAC 200PI Pedal Integrator,"I was looking for a synth module that could integrate guitar pedals. I saw a recommendation for this module, and I wanted to look at the price and availability.",6/24/22 19:17:00
ADCXHGCQRA34,54cb9963-0580-44eb-ae54-9fcbbf250a51,2f7298f1-010b-4733-974e-fb7c796c93ae,false,,i am the storm that is approaching lyrics,Looking for the song name that has this as a line in the lyrics. I am hoping I can find it in the first result.,6/23/22 17:44:00
NFN2M74RPJ2Q,4c9d8154-373f-4aac-8975-037110fdeaae,2fa772d9-c54d-4de6-ad6e-02897fcb058c,false,,Best times of year to visit Myrtle Beach,"I've been thinking about holidays recently and was interested in Myrtle Beach and would like more information. Any travel site or official tourist site might be useful, even user forums, as long as there is plenty of credible information available.",6/16/22 14:05:00
AZZDZJGYZWJ3,679d8079-78d1-4166-b492-f18f13ce7734,2fe1b6aa-243f-4919-ae89-cd3e3fd039a0,false,,twitter,"I wanted to get to the Twitter site, so I did that via a Google search.",6/26/22 21:37:00
4TR6J693M9XK,2b63ae58-d9ec-4539-8f5f-1ad9ebbc8696,304480c8-a40e-49ac-a50a-95f7c9892c40,false,,mb tuxedo,mb tuxedo is a tux specialty shop and bridal shop and I was wanting to look them up to see their store hours.,6/27/22 20:31:00
AZZDZJGYZWJ3,7da9b267-018b-43c9-9feb-978710bd6d49,30d2a60c-3f52-44f9-887b-39280629ef81,false,,air force one 1997,I was looking for info related to the movie of the same name/year as I remember reading an opinion about Harrison Ford's mood towards doing movies since then.,6/25/22 07:22:00
X6P6DQRXD62A,d0125d7c-3042-4ab4-9840-99ed6e0ce38a,31055ba6-8d0b-40fd-b823-c21ac7aadae8,false,,Tokyo Twilight Ghost Hunters Daybreak: Special Gigs steam,"Tokyo Twilight Ghost Hunters Daybreak: Special Gigs is an updated version of a game I had searched for previously. I was looking for a link to the Steam store page for that game, which would contain a wealth of info on it.",6/16/22 22:25:00
4TNHZX6VKQAA,484050db-ba00-42a9-a29a-bee90c5dd1df,319cbe88-0630-484e-96d9-2831f29e2363,false,,botanical garden ucla,I wanted to know what the hours are for the botanical garden on UCLA's campus.,6/18/22 11:20:00
