ADCXHGCQRA34,4b1b68be-8ca9-4c99-9ccb-41c2b38a0003,33fe32df-f81f-4469-926f-eaeca1cf1154,false,,calories in Kirkland Signature roasted chicken and swiss roller tray,I want the calorie count of one serving of Kirkland Signature roasted chicken and swiss roller tray. I need this to enter into my Fitbit.,6/11/22 15:37:00
4TNHZX6VKQAA,0829439b-9e93-4efb-83f9-f23b0c1746cc,3416108b-a547-4458-861e-aeeda45d69e4,false,,What is the STRONGEST muscle in the human body?,I wanted to know what the strongest muscle in the body was (the one that can exert the most force).,6/14/22 23:05:00
MVMZFQEH2MYN,ccc357c9-c16b-4473-9ce0-8f351800d548,3536bdbd-e77f-4c60-89a0-7bb8bf6bc2ba,false,,mlb games now playing,I had some free time and wanted to check if there were any baseball games going on at this moment,6/19/22 23:45:00
6CNHTCG6W6XM,1dd47563-d9e9-4262-8395-5617cf148460,359d2c06-b8fa-43b6-bfca-7650db8866bb,false,,kyowa brand,I was wondering if Kyowa is a trusted brand and I also wanted to know where the brand originated.,6/19/22 10:01:00
AZZDZJGYZWJ3,26d7efa2-a0b8-4b57-936a-121c5a007e39,35bf1132-9de0-4d05-b5cc-b9082fa3ab25,false,,mitb,"I was looking to see when Money in the Bank, a WWE show, would be taking place. I figured I'd get an answer from this search.",6/26/22 14:16:00
QD6PJTFGJ63Q,9a9b3f25-09e4-47fc-a775-a068c6afecbc,3658af9a-6597-48d2-a013-20d3a3b6c995,false,,patellar tendinitis same as runners knee,This was an effort to try and self-diagnose knee pain.,6/23/22 16:21:00
QD6PJTFGJ63Q,eeac2287-7410-42e5-9aff-86bc088f8466,366bfd30-e0a5-4e4e-be2b-d8725d4adb1e,false,,ts-b2 tip ebay,"I figured I would search for the tip on eBay, because sometimes it is cheaper there.",6/27/22 18:05:00
X6P6DQRXD62A,24ff610d-d8b6-47fd-afaf-9bd08c3129a7,36953a9b-2e9c-4d54-9c9d-7e2bc9ab9719,false,,blue screen kernel mode heap corruption,"Lately, my computer has bluescreened twice and given me this error message. I wanted to know what it meant and how to fix it",6/19/22 21:42:00
MVMZFQEH2MYN,fd4e3ee2-48bd-4495-b3e5-0633b3924787,36cc55cc-51ef-4f6e-9791-280435963758,false,,index match to find max value,"I need a formula that finds the maximum value in a column C, then show me the name of the item in the same row in column A (kinda difficult to translate, but I think it is clear)",6/11/22 01:10:00
EGZANDYA4C6Q,ad81f647-7cbc-4a10-ab7c-211c4d91d85d,36d94c61-ac9a-42f2-bfb0-0cdac11eb8d9,false,,forbidden door results,There was a wrestling pay per view that I missed last night and I wanted to read the results. I was expecting to find various wrestling news stories at the top of the page.,6/27/22 15:15:00
X6P6DQRXD62A,14ee8a63-3426-4e6e-a8f0-050b1f6c6d4a,373e3cc6-a92b-4d3f-91e7-849ff8ec744a,false,,Ethereum price coingecko,"I was looking for the price of the cryptocurrency Ethereum, and wanted to view the price on the website coingecko",6/16/22 11:56:00
QD6PJTFGJ63Q,b436c724-2119-4b88-8500-2f93cd61ad46,375d7190-d7f3-4dc9-a9a9-9aa582dbb3cd,false,,mutable sheep firmware,I was trying to find firmware for a modular synthesizer I have. I was hoping for one that was already compiled for me.,6/24/22 21:52:00
ADCXHGCQRA34,260d803e-56f6-4eb3-a151-a487544a3d5c,37b36cc5-983b-42e7-beea-b11b24628dbf,false,,california electric car law company retiring nuclear power plant,I want to see when California's last nuclear power plant will be shut down. Hopefully there is a snippet so I don't have to click on webpages.,6/22/22 18:12:00
MVMZFQEH2MYN,65401fb2-68e2-425a-b1d5-286f0b7ca6c4,38be1942-70bd-4107-8d1f-3d65f80b0a1b,false,,doordash average price per delivery,"I wanted to check how much DoorDash charges for ordering from their app, since a friend mentioned that they usually pay a bit too much for this service",6/22/22 21:23:00
EGZANDYA4C6Q,1347ecd6-7cb7-4b12-b8df-c2eabd90dd69,3973e0c9-8a50-41bd-b965-f8dad214f19a,false,,orbitz,I wanted to check airlines prices for various destinations. I was hoping for the actual Orbitz website to be at the top of my search.,6/27/22 15:53:00
MVMZFQEH2MYN,3b45835a-9f24-4503-968c-2126ef036297,39fb00fb-a181-4575-b999-62b6ead5cdec,false,,gsw vs celtics games,"I wanted to check the results of game 4 of the NBA finals at this moment, since I cannot watch it yet due to being a bit busy working.",6/10/22 21:05:00
QD6PJTFGJ63Q,79fae8a6-8c1b-46cf-becd-0f0a4c11337e,3ab06dd2-ce03-4d1d-aa7b-9932bea15591,false,,Kailh Low Profile Choc Keycaps,I was looking for keycaps to purchase.,6/23/22 00:18:00
X6P6DQRXD62A,b1c75bc7-77cc-4efa-a986-2521f9e1e263,3ab8e4bb-1449-4df5-9f16-13ab3ed1c0d9,false,,the steam client service on local computer started and then stopped,My brother kept getting this error when trying to start Steam on his PC. I was hoping to find a page that had a solution to the issue,6/17/22 20:25:00
4TNHZX6VKQAA,8f027211-e56e-438e-b95e-19c634c5aacd,3ad131a0-b84a-490d-8556-a95e902aa2a7,false,,wolf to human size,I wanted to visually see how large a wolf is compared to a human.,6/21/22 10:40:00
4TR6J693M9XK,9850d738-a28b-4861-af02-772ecad5a410,3b0aea0c-3901-4c45-8fb7-0d4fba7ced51,false,,pizza hut,I was looking for one of our local pizza hut's phone numbers to call and place an order.,6/28/22 20:42:00
AZZDZJGYZWJ3,ff5aeb26-d186-470c-8652-9bf957176c24,3b734fa6-c050-40b3-b7ed-ce64c3d5743a,false,,twitter,I was looking to get to the Twitter site via a Google search.,6/25/22 12:08:00
6CNHTCG6W6XM,a0d1e97a-46f8-419d-8e39-eba32a76a8da,3ba59dcd-3cb1-4e06-b4b1-fd6149707658,false,,"£23,000.00",I wanted to find out the conversion of the said amount to Philippine Peso including the current exchange rate.,6/22/22 11:10:00
MVMZFQEH2MYN,183b52e8-b124-48c1-a297-d83df2fa61ee,3bd8dc8f-a199-4b3a-8592-7b335bb2df78,false,,peru australia game,I wanted to check the exact hour for this soccer game,6/13/22 11:49:00
AZZDZJGYZWJ3,800306d2-550a-49cd-b62b-f6100879b81d,3c76d8d8-8570-4d92-aac4-b31c26f91540,false,,Kevin Costner: Gene Hackman,"I wanted to find out what movies Kevin Costner and Gene Hackman co-starred in after watching an interview with Kevin Costner. I was just looking for a movie, not necessarily a list.",6/26/22 10:16:00
MVMZFQEH2MYN,e5e04c53-798b-4cd8-ae8f-bcf90c556d5a,3c7afe02-d58f-46f0-af78-a4e0ff652fbf,false,,game of thrones epic games,"A friend recommended me this game to play online with other friends, so I wanted to check it out",6/23/22 22:47:00
QD6PJTFGJ63Q,3fd47ae4-2828-423c-a777-571f6e5b8542,3d485583-7fb1-4f30-823b-934e8c6ba579,false,,Bg processing Orem Utah,I get an email notice from USPS every day. I saw a letter addressed from this sender. It seemed suspicious so I was trying to gather information about them.,6/25/22 09:47:00
X6P6DQRXD62A,1fbd417b-142c-4966-a8be-8c9b8c2aaf53,3df9e871-9c03-4cd4-be87-0abdc254ccef,false,,Scourgebringer,I saw the game Scourgebringer in a Youtube video about Vita games. I wanted to find a review of it to know whether to download it,6/19/22 07:11:00
4TNHZX6VKQAA,7488ec3a-980b-44d1-a391-fccee21380b8,3dfc01b7-e8c3-4d19-a208-b4b2ecd0b373,false,,the broad museum,I wanted to navigate to The Broad website to reserve tickets for the art museum.,6/14/22 20:48:00
ADCXHGCQRA34,f9e1b560-8e75-42ec-b9a6-63f2cb9d655f,3e186b7c-6edb-44d4-9f1e-7caafa07ff8b,false,,Can a dog have seizures due to its environment?,I am trying to find a cause for my dog's seizures. I want to see if it's possibly an issue with possible stress.,6/19/22 21:00:00
Z99F437AMJC2,fd83c308-9b42-4c60-8b2c-4961c221f44b,3fa0faa0-8422-4164-906f-e77b98528d69,false,,CoachDaGhost,"I'm trying to find information on a popular rapper, I hope to find news on him under the news tab",6/21/22 13:03:00
6CNHTCG6W6XM,891cb957-596f-46a3-93d0-aca32aca1225,3fd19c96-72ae-4e28-92ef-0f778d7d17aa,false,,how to clean birkenstocks,"I was looking for tips on how to clean my Birkenstock sandals. I wanted to clean my sandals but given its sensitive material, I wanted to know the right process in doing so.",6/11/22 12:59:00
7R2NKCJQNXPP,7d6f154b-e2b7-4c31-88af-a2a9cd16cd70,40d683e3-9db8-4737-84ae-8ef5850695a2,false,,head and shoulders apple vinegar cider rinse,I was looking up reviews for a product I am interested in trying.,6/22/22 14:35:00
JXPAPGM4VFYE,68c55ec9-d7ea-4ce2-8bab-7fae138c161e,40e4ed4d-352c-42c7-ac91-512d08157b78,false,,does pearson lock assignments,"Since I cannot find a code for access to Pearson's assignments, and since Pearson offers a free 14 day trial, I wanted to see if all assignments would be available immediately. If assignments are not locked, and available throughout the course, then I will complete all the Pearson assignments before the 14 day trial is up, and not have to worry about Pearson for the rest of the course.",6/27/22 12:51:00
QD6PJTFGJ63Q,4c1909e1-c4fe-4c3f-b7fa-4c84aad73be9,41383e66-2480-40a2-b2e2-0b1197b5a9d7,false,,does hydrogen peroxide dissolve ear wax,I saw a recommendation for this method to clean ears. I wanted to see more information about whether this was a good idea or not.,6/25/22 12:02:00
7R2NKCJQNXPP,9e1e77dd-f6e2-41ce-ad6e-aaeed1b17a1e,4339ac0f-0787-4301-a1e1-c017012771df,false,,4th of July fireworks near anoka,I am looking for fireworks date and time.,6/23/22 07:15:00
4TNHZX6VKQAA,f1d3ebca-ace4-449f-acca-a857a83793c2,43815447-177d-4a0f-919d-768251163916,false,,eventbrite la,"I wanted to know what events were coming up next week in Los Angeles, CA.",6/15/22 20:58:00
MVMZFQEH2MYN,2d82db29-f04a-4ab7-98a7-092e8192f115,43d981a6-7f3d-4a54-890c-dc2d4dc5350b,false,,highlight rows with conditional formatting,I wanted the exact formula to add a background to the entire row within certain conditions,6/24/22 01:13:00
AZZDZJGYZWJ3,0951c032-b228-4e34-8e79-23e761dd2dab,44c685dc-c998-437f-9f4e-a14de740291c,false,,"""V&A"" artwork ID for California Institute of the Arts?","I searched for the same result without """" a minute earlier but I added the """" to see if I could find anything more specific.",6/29/22 01:30:00
AZZDZJGYZWJ3,e6c52eea-6d31-4eff-bcf5-8bba7a611af1,44d37d36-2db1-4bba-a509-9bbf398ff7ae,false,,billboard,I wanted to get to the Billboard music site. I wanted to see how Kate Bush was doing on the Hot 100 I believe.,6/24/22 11:44:00
X6P6DQRXD62A,0a8a3ebd-96d4-47c2-aff4-3a25c0fb4d11,453c50f3-1f23-410a-b01b-5d3ca62492ed,false,,rog strix rewards,ROG Strix is the brand of gaming PCs made by ASUS. I wanted to find the homepage to their rewards program for owning one of their products.,6/16/22 20:54:00
EGZANDYA4C6Q,c4d368f5-da81-43c8-8355-6c48a34021e4,45b9053e-59e0-4e2b-96fd-c5f754900434,false,,adam cole concussion,I heard about the wrestler Adam Cole suffering a concussion on a pay per view and wanted more info. I'm expecting to find news results with more or any information on the injury.,6/27/22 17:47:00
4TNHZX6VKQAA,234fb07b-813c-4f6d-b99b-0205054c92db,4763a2b6-ffa6-4516-89df-2d67eee7a9dd,false,,what to do in sawtelle,"I was looking for what to do in Sawtelle, a street/neighborhood in Los Angeles.",6/14/22 20:50:00
ADCXHGCQRA34,19437236-46ee-4161-ba8e-aed9945d0671,483bbe32-9afc-4cc6-966d-c56bcf5c6b56,false,,misanthropic definition,I need to know the definition of misanthropic. I hope I can get a quick answer instead of clicking on links.,6/15/22 22:00:00
NFN2M74RPJ2Q,b3bd611c-96b7-49dd-b0e5-bed2b35ce981,495e5e99-1282-4b43-ad2f-0b6189b5cf59,false,,vmware VDI sizing guides,"I'm trying to size a VDI environment for servers in a data center and want a good guide, ideally from the VDI software vendor with sizing recommendations based on average users. This needs to be a good guide but doesn't need to be too specific.",6/19/22 19:20:00
4TNHZX6VKQAA,f4cb747e-548e-4918-bafe-d7f10483d297,4a6e9902-29a4-4e97-91c7-8f2c51831986,false,,model pliers,"I wanted to know what ""model pliers"" were and if they were different from regular pliers.",6/13/22 17:43:00
NFN2M74RPJ2Q,cfa5415f-7540-49f2-ad2e-6c038bcd9dbf,4b807787-fee7-4d3f-90f3-7328ada53bb4,false,,roof repairs near me,I've got a leaky roof that needs a repair as soon as possible so I'd like a list of good local roofers who can get to work as soon as possible,6/20/22 12:45:00
X6P6DQRXD62A,44373dce-8379-4fa8-9be5-40ae40bb25d2,4c1e89f8-60d4-47b8-bac7-d53026e75970,false,,bluestacks,Bluestacks in an android emulator for windows. I was hoping to find the official site so I could download it,6/17/22 13:11:00
NFN2M74RPJ2Q,ac502ca7-1b50-45b8-b340-6522621bd63e,4c2e2ed5-3fd6-4403-87ae-755d2f1b2deb,false,,New TGI Friday's opening in York,I know that there's a new restaurant opening near me at some point soon but I want to know when that will be as work on it hasn't started yet. The official site would be good if there's news there or something more local to myself where they have some useful information.,6/13/22 21:02:00
QD6PJTFGJ63Q,bf9dcb77-ec2a-4c7a-a1b7-fe585f810d66,4c47a398-2aa0-4485-b650-103bd3013687,false,,1u precision adder,I'm looking for this type of synth module in the 1U size as opposed to the 3U size.,6/27/22 11:01:00
6CNHTCG6W6XM,9d954bab-1c6c-46e6-8126-86d655513854,4d1f5963-8257-4353-9bf6-d9298d0333a4,false,,uvea,I wanted to find a diagram or image of the Uvea which is an eyeball part.,6/24/22 21:27:00
QD6PJTFGJ63Q,38a5fb47-ab9f-4afd-9e67-bce7afb566f8,4d31c2eb-c200-40a3-8e2c-0e28a6cdad28,false,,m8 shortcuts,I have a music instrument that has a few general purpose keys. I wanted to find a list of the key shortcuts.,6/24/22 23:40:00
AZZDZJGYZWJ3,280107f6-bb88-472b-933e-7ff853bf1c90,4d798d8f-4f02-41d3-8ffd-797d90899936,false,,twitter,I was looking to get to the Twitter site via a Google search.,6/25/22 10:57:00
ADCXHGCQRA34,a164f543-2ec1-48ba-979e-753e1aad6d76,4e9a82a2-53cf-42d4-879d-701a50634592,false,,pizza delivery near 33709,I am looking for a pizza restaurant that delivers near my zip code.,6/24/22 14:10:00
QD6PJTFGJ63Q,54793609-aa34-4f75-b992-1fbeaa54a512,4eca9e91-7eb5-4bfe-907e-1cafeac060f8,false,,4 person tent,I need a new tent for an upcoming camping trip. I was looking for a shopping search mainly.,6/24/22 23:25:00
MVMZFQEH2MYN,4ae2b061-a252-449f-9519-ba8d3dc291b2,4f026f7b-e4e8-47b6-a546-e8c204dcead8,false,,Twitter Downloader,I saw a fun video on Twitter and wanted to download it and share on WhatsApp,6/24/22 18:14:00
ADCXHGCQRA34,572e9ad4-5a8b-477e-9a06-20ed28415749,4f6e38f8-405c-44d2-b5b9-c4b387fe4363,false,,deserts in the united states,I want a list of the deserts in the U.S. The first result should show me this.,6/22/22 18:40:00
6CNHTCG6W6XM,fb1cbb40-3078-4c98-a5b0-ca58e3ea9a58,4fd1ef49-1744-4e1f-bcbe-dfb05c7a1311,false,,my condolences,I wanted to check on the proper way to offer condolences to someone who had a love one that died. I was hoping to find the correct words to used because I am unsure of my statement.,6/24/22 16:26:00
MVMZFQEH2MYN,a2b3f78f-bd3d-48dd-afb2-a954a041f3b6,4fe1600f-c5be-4d9d-9efb-ad21e984987a,false,,btc price,I wanted to consult both the actual and the historic prices of this cryptocurrency and maybe some news about it.,6/16/22 23:58:00
EGZANDYA4C6Q,544b8126-4af7-442a-b596-e6e25102d8d3,5014e3a5-9664-4102-9d89-81edf01037d5,false,,max caster,I was trying to find a photo of the wrestler Max Caster to confirm he is who I was thinking of.,6/28/22 18:50:00
6CNHTCG6W6XM,dbc4ab14-2362-425f-94b1-0e315bbc4e88,505d98e7-4f44-4c11-82a0-41df5d4180bb,false,,hepatek price philippines,I was trying to search for a price of a particular food supplement for my personal use.,6/10/22 15:51:00
4TNHZX6VKQAA,39c2c73e-cf28-4bfa-92bb-07292a528d80,5076e87a-4912-43b6-95b6-ab2061853197,false,,around and around we go,"I was looking for where the expression ""around and around we go"" originated from.",6/14/22 19:06:00
QD6PJTFGJ63Q,f7372031-b26b-4a54-87ff-2ff53d30be95,520eaef2-aa05-4f6b-aacd-5ab50dde11e3,false,,jungle jungle sample pack reddit,I was hoping to find a long out-of-print drum sample pack. I hoped that there had been a Reddit discussion.,6/25/22 12:57:00
4TNHZX6VKQAA,c2a754a0-05b8-4703-a052-15c7e2cf1aa4,5227c242-ec94-40f0-9a1d-dbe21b37544f,false,,covid 19 pain reliever,I was looking for which over-the-counter medications are helpful for treating COVID-19.,6/17/22 22:02:00
6CNHTCG6W6XM,5fd494c7-77fe-41f1-876b-c0a3c1458574,5249b076-bf9d-414b-bcb7-933f08c35e21,false,,how to get nmc pin,I was hoping to find guides or how tos in getting the NMC pin. I would also prefer if it was from the actual NMC website but they do not really provide accurate results.,6/22/22 11:28:00
X6P6DQRXD62A,3062b93d-023f-40cc-8c4a-ba29872799b6,52acb257-4e43-47e6-9244-908ab51468e1,false,,legend of dark witch ps vita review,"I was looking for a review of the PS Vita game ""The Legend of Dark Witch"" in order to decide whether or not to download it.",6/16/22 05:28:00
6CNHTCG6W6XM,e989c700-8470-464b-9bcc-9d73859a8f7b,52e580bf-96d6-4f6e-998b-9b0965ce445e,false,,ramsay hunt syndrome,I wanted more information about Justin Bieber's current health condition. It was in the news that he is currently suffering from Ramsay Hunt Syndrome.,6/11/22 08:54:00
AZZDZJGYZWJ3,202cb90c-fd1f-47f5-a9cc-3591a3a7a6f9,5338de44-e2b6-4c4d-984c-0b5acb730780,false,,"Xenopus Anatomical Ontology ID for the ""musculoskeletal system""","I really wanted to make sure the results included the ""musculoskeletal system,"" otherwise this is the same search I made at the same time just prior. I wanted to see the ID for the musculoskeletal system from this specific entity.",6/25/22 12:47:00
MVMZFQEH2MYN,c4ab7620-b794-4028-adff-9fe9011e244f,542cd86c-aae8-4e0d-8c7f-d90057995c53,false,,wow hunter tbc bis,I wanted to check the best items for a character in a videogame,6/12/22 16:31:00
4TNHZX6VKQAA,f4f43773-cd54-4ca8-aefc-03c771ccd98d,566e30f8-a8cf-4836-9d00-6be9151b1335,false,,masseter,I wanted to know what the masseter was and where it was located on the body.,6/14/22 23:06:00
6CNHTCG6W6XM,fe2c9512-171f-4139-811a-9d8d1ca388bb,56a279b0-6d27-4536-8ddb-f542eb9a5e03,false,,philsys national id requirements,I was looking for a list of requirements needed to apply for a particular government ID. I wanted to access official government websites indicating such list if available.,6/11/22 15:24:00
6CNHTCG6W6XM,b223bb31-fa50-465e-b3c6-b1fcdd16e591,56eb6207-6a04-4c2f-84e8-7c9dee66d45e,false,,9am british standard time to philippine time,I wanted to know the exact time here in my country when it is 9 am in the UK.,6/23/22 22:53:00
MVMZFQEH2MYN,1b8bb617-1b18-418a-9b9c-065406a515cc,574c36a2-7db4-417d-8818-2c4cac6d78d6,false,,match variables sheets,I wanted to check all the conditions that I could use with the Match function in Google Spreadsheet,6/24/22 02:13:00
4TNHZX6VKQAA,eeac1d1a-7211-4185-a7cc-8e8d1dbd8e1a,579d1ee9-287b-486b-9e73-8ce54d700b21,false,,all wordles so far,"I wanted to see a list or the words used in the game ""Wordle"".",6/11/22 01:01:00
4TNHZX6VKQAA,858e6b37-d55a-417e-b216-7290c17f54d0,58901df9-0810-40ec-b14a-3dccee711a83,false,,new delhi vs delhi,I was looking to see what the difference is between New Delhi vs Delhi.,6/22/22 13:40:00
4TNHZX6VKQAA,d3351eea-1aff-46d8-97cc-98d246985c37,58d51358-66ba-452a-9ce5-ed6f33deab3f,false,,tonal languages list,I wanted a comprehensive list of the major tonal languages.,6/15/22 20:51:00
ADCXHGCQRA34,fa8cebaa-7c54-43db-8730-85bfcee5c9ca,58f5dadc-c5fa-490d-9e28-6d6b1ff5afce,false,,chewy promo code,I was looking for a coupon code for Chewy.,6/11/22 09:50:00
QD6PJTFGJ63Q,d52653b6-4e7f-4a60-b983-adb126395268,5960be96-a82c-4b05-95ae-a3e359f5ac97,false,,machinedrum elektron sophie,"I know a musician uses a particular machine, so I was checking to see if I could guess the particular machine.",6/23/22 09:31:00
AZZDZJGYZWJ3,212ffeea-4582-4222-94c6-05ba9306e1f1,59a117eb-a252-4df5-9559-09fc22473603,false,,boil,I was trying to see pictures related to what boils on the body look like. I was hoping the search would provide some clarification.,6/27/22 16:16:00
4TR6J693M9XK,610869bd-7400-4c24-bb82-dac22c8dc757,59a4e9bc-20c8-42a5-848a-4a56590fd4bf,false,,Bridal Party gifts,I want to look up some good gifts I can give my groomsmen on my wedding day.,6/24/22 08:11:00
4TNHZX6VKQAA,e93904b1-d991-4849-841e-920a8269a276,59c22fd7-a11b-49df-a2ff-5844253d4df6,false,,wolf running away,I was looking for a reference image of a wolf running for a short animation I was developing.,6/21/22 10:33:00
MVMZFQEH2MYN,e30f3399-4df0-437b-9042-d4950f1949a3,59d484b4-4c50-4008-b7b8-b363adbd718b,false,,timer in 15 minutes,I wanted an alarm or reminder in about 15 minutes to go check the kitchen,6/16/22 23:34:00
4TNHZX6VKQAA,48a9fe21-6bee-4e7b-b999-18487cb5bcca,5a49bb60-c543-4f8a-b755-386a6f8f70b7,false,,don't get out micro tdh,"I wanted to play the song ""Don't Get Out"" by Micro TDH.",6/20/22 09:24:00
X6P6DQRXD62A,540ab9b9-47da-4b26-9a4d-25439eebb619,5a715890-9f1a-47c1-869e-74710b249fa8,false,,ps vita open me ar card,I was hoping to find images of the AR cards used for certain games with the PS Vita,6/17/22 13:25:00
ADCXHGCQRA34,854d2623-cc73-4e5e-b982-195ba0c29717,5a7af26c-0af4-43d9-84d0-6a24cd6771d7,false,,zachary latham,I want to find out more details of the murder case against Zachary Latham.,6/12/22 06:24:00
Y72KN4H9FMJJ,0cb2e5b9-0694-4d59-97c5-8fcba24c1980,5ab8ba2b-0bc7-458c-bdd7-d5ee50c6c429,false,,ibuprofen 800mg side effects,"I'm trying to find the side effects for the medicine ibuprofen (in 800mg pill form), ranging from common side effects to rare side effects.",6/11/22 08:29:00
MVMZFQEH2MYN,669541a2-2d60-4bdc-a424-f9e7525a300c,5b1b267b-8068-4d87-9f7f-b3f4fe9e6f89,false,,youtube polyphia playlist,I wanted to listen to this band newer songs,6/15/22 15:46:00
QD6PJTFGJ63Q,9c6907fb-7c39-4678-9243-a44d19d9fd44,5b95e0a9-a32b-4986-a6d9-627a21f154b8,false,,Terminal ASCII art,I was curious if it was possible to do ASCII within the terminal of MacOS.,6/25/22 22:03:00
NFN2M74RPJ2Q,9d9c500e-d486-47a3-875e-5d51cf5fed04,5bdd779c-8458-4062-a7fa-f392fa3dff02,true,,children's birthday party venues York,I'm trying to find good ideas for party locations for my daughter's upcoming 5th birthday. I'd like to see a variety of suitable locations nearby but also some parent sites/forums that have reviews and other ideas,6/18/22 20:00:00
X6P6DQRXD62A,1dc66965-0df2-480a-852f-09b764cd794a,5c208371-af3a-4e9a-96c6-6d26b2ef6f1a,false,,am2r latest version,AM2R is a fan remake of the game Metroid 2. I was trying to find out what the latest version that had been released was,6/15/22 00:36:00
AZZDZJGYZWJ3,28243bbd-580a-41d7-aec6-4748ce7bf582,5cd95d3b-6b45-4a3d-a966-81b76ba21b8c,false,,twitter,I wanted to get to the Twitter site and knew I could do so via a Google search.,6/28/22 16:05:00
MVMZFQEH2MYN,a7206143-e340-4b57-ba17-3868a50ea4c5,5cf7ad8f-623c-4780-9db3-b2c55a236e06,false,,best towns to visit in peru,"I am planning a small trip soon and wanted to check my options, flights, reservations, places to visit, etc...",6/17/22 13:22:00
AZZDZJGYZWJ3,eeb69b7e-9f55-4027-9cd4-7a9e75ddefc7,5ed30f72-a2ad-420b-a66c-84101293c64c,false,,Tina Charles,"Tina Charles was agreed to a divorced contract from a WNBA team, and I wanted to find more information about her.",6/25/22 12:10:00
7R2NKCJQNXPP,7ae6c9bd-04c9-4c54-afd0-ad06ddfea568,5f68ce39-91ec-42a0-892f-9aceb773830c,false,,anoka football 2022,"I am looking up my son's football schedule for this week. Summer practices start this week, but I haven't received a schedule, so i am googling to see if it's posted to the site yet.",6/13/22 12:33:00
ADCXHGCQRA34,11b62578-bd27-4861-866b-73646a871581,5fafbc5c-29cc-4842-968e-9a847a9cffad,false,,Michelin star restaurants in Pinellas County Florida,I want to know if there are any Michelin star restaurants in my area. I hope the result will show ones close to me.,6/13/22 17:50:00
MVMZFQEH2MYN,c61a9d98-6768-4c9b-8124-08caa93aeda2,5fb5a3e0-b5fd-4d35-8ed9-3fe7c0836317,false,,roe vs wade what happened,"I wanted to check what's the whole deal with this news, since it seems to be in all my social media",6/25/22 10:00:00
MVMZFQEH2MYN,20dc977a-c00b-4a01-a1a4-4c283bd1b5ce,5fc7e9f2-272c-474e-a4fc-453632229a90,false,,twitter downloader,I wanted to download a video from a Twitter post,6/11/22 22:22:00
X6P6DQRXD62A,c19f37b7-e027-4feb-846f-82647350811a,5fd24c51-b670-4b00-b4c1-cee7d021f9ad,false,,rheumatoid arthritis,I wanted to learn about the disease rheumatoid arthritis after my mother was diagnosed with it.,6/14/22 10:07:00
QD6PJTFGJ63Q,4c76a561-2f16-4433-998b-5eb651935721,618fd21b-0347-4fe2-9e39-beb905568e84,false,,Utah State Tax Commission,I received a tax notice. I wanted to visit the official site to see the full details.,6/23/22 08:03:00
4TNHZX6VKQAA,4b5f123e-2db6-402a-9f72-07fab130abe7,62f58b06-47d9-4d36-8430-c16dcd71a33e,false,,usps tracking,I wanted to track a USPS package online.,6/21/22 11:03:00
7R2NKCJQNXPP,4174d5be-1a5a-463c-a100-aaf926272817,63374a11-023f-4be9-acd9-8dcfa91c48cf,false,,how to pan fry bratwurst,I am making brats on the stove top and wanted to check the cook time,6/29/22 08:15:00
4TNHZX6VKQAA,3a8749c6-079d-4ef2-9545-1c7bf3923c4f,63abbc0e-e5ba-4d75-a404-02da73059aab,false,,is r kelly in jail,I wanted to know whether or not R Kelly was currently in jail.,6/19/22 17:00:00
MVMZFQEH2MYN,7880a444-1fc3-498e-b06a-0f9b269a593b,63e6bc7b-535c-49d3-9c9e-d0ccdd7fef4f,false,,best android autoclickers,I wanted to check the best apps of this type for a blog post I am writing,6/15/22 17:24:00
QD6PJTFGJ63Q,aff3b908-5e83-4377-8fe2-a496d3f44615,6525a5ff-800a-470d-b9d9-e3ff549cc116,false,,patellar tendinitis,I had minor knee pain. I was searching for possible causes.,6/23/22 16:20:00
4TNHZX6VKQAA,acad6b10-1f4a-4d2a-8ed6-d0040b499581,659d4097-9b8e-40da-ab66-d73fe5b2a60a,false,,snake extermination,"I wanted to know how snakes get exterminated. I was researching this for an animation about the ""cobra effect.""",6/21/22 22:49:00
MVMZFQEH2MYN,8b05debf-8896-4172-9c68-1892287ee751,66643f0a-745a-4c64-a456-64604e5a5e87,false,,colombia election 2022 candidates,I wanted to check more about the presidential candidates in Colombia since tomorrow there will be elections in this country,6/18/22 15:43:00
